Description,UnitPrice,Country,Quantity
BLUE TEA TOWEL CLASSIC DESIGN,1.25,United Kingdom,2
CLEAR MILKSHAKE GLASS,2.1,United Kingdom,2
IVORY PILLAR CANDLE SILVER FLOCK,2.95,United Kingdom,2
4 IVORY DINNER CANDLES SILVER FLOCK,2.55,United Kingdom,2
CREAM SWEETHEART MINI CHEST,12.75,United Kingdom,2
CREAM SWEETHEART LETTER RACK,5.45,United Kingdom,2
FAMILY PHOTO FRAME CORNICE,9.95,United Kingdom,2
RED HANGING HEART T-LIGHT HOLDER,2.95,United Kingdom,2
RETROSPOT TEA SET CERAMIC 11 PC ,4.95,United Kingdom,2
RETROSPOT HEART HOT WATER BOTTLE,4.95,United Kingdom,2
DOORSTOP RETROSPOT HEART,3.75,United Kingdom,2
EDWARDIAN PARASOL BLACK,12.72,United Kingdom,2
TEATIME PUSH DOWN RUBBER,0.84,United Kingdom,2
RECYCLED PENCIL WITH RABBIT ERASER,0.43,United Kingdom,2
ORIGAMI JASMINE INCENSE/CANDLE SET,2.51,United Kingdom,2
RED HEART LUGGAGE TAG,2.51,United Kingdom,2
PINK POLKADOT BOWL,2.51,United Kingdom,2
JUMBO BAG OWLS,4.21,United Kingdom,2
LUNCH BAG WOODLAND,4.21,United Kingdom,2
LARGE PINK GLASS SUNDAE DISH,5.06,United Kingdom,2
FRENCH PAISLEY CUSHION COVER ,9.32,United Kingdom,2
PINK ROSE FABRIC MIRROR,2.51,United Kingdom,2
SET/3 TALL GLASS CANDLE HOLDER PINK,25.49,United Kingdom,2
12 PENCILS SMALL TUBE RED RETROSPOT,1.28,United Kingdom,2
ROSE DU SUD DRAWSTRING BAG,3.36,United Kingdom,2
VINTAGE BILLBOARD TEA MUG,2.51,United Kingdom,2
KEEP OUT BOYS DOOR HANGER ,3.36,United Kingdom,2
WHITE BELL HONEYCOMB PAPER ,3.36,United Kingdom,2
PACK OF 72 SKULL CAKE CASES,1.28,United Kingdom,2
BALLOONS  WRITING SET ,3.36,United Kingdom,2
TOAST ITS - FAIRY FLOWER,2.51,United Kingdom,2
RED SPOT CERAMIC DRAWER KNOB,2.51,United Kingdom,2
BAG 500g SWIRLY MARBLES,3.36,United Kingdom,2
SWEETIES  STICKERS,1.66,United Kingdom,2
SNOWFLAKE PORTABLE TABLE LIGHT ,5.91,United Kingdom,2
DECORATIVE ROSE BATHROOM BOTTLE,2.51,United Kingdom,2
DECORATIVE CATS BATHROOM BOTTLE,2.51,United Kingdom,2
RAIN PONCHO RETROSPOT,1.66,United Kingdom,2
VINTAGE HEADS AND TAILS CARD GAME ,2.51,United Kingdom,2
GLITTER STAR GARLAND WITH BELLS ,7.62,United Kingdom,2
EIGHT PIECE DINOSAUR SET,2.51,United Kingdom,2
LILAC DIAMANTE PEN IN GIFT BOX,4.21,United Kingdom,2
POTTING SHED TEA MUG,3.36,United Kingdom,2
POTTING SHED SEED ENVELOPES,2.51,United Kingdom,2
PHARMACIE FIRST AID TIN,13.57,United Kingdom,2
STRAWBERRIES  DESIGN FLANNEL ,1.66,United Kingdom,2
PACK OF 60 DINOSAUR CAKE CASES,1.28,United Kingdom,2
PACK OF 12 PINK POLKADOT TISSUES,0.85,United Kingdom,2
FLORAL FOLK STATIONERY SET,2.51,United Kingdom,2
PINK DOUGHNUT TRINKET POT ,3.36,United Kingdom,2
6 RIBBONS ELEGANT CHRISTMAS ,3.36,United Kingdom,2
6 RIBBONS RUSTIC CHARM,3.36,United Kingdom,2
PIZZA PLATE IN BOX,7.62,United Kingdom,2
CHRISTMAS CRAFT LITTLE FRIENDS,4.21,United Kingdom,2
FELTCRAFT BUTTERFLY HEARTS,3.36,United Kingdom,2
FELTCRAFT 6 FLOWER FRIENDS,4.21,United Kingdom,2
LOCAL CAFE MUG,2.51,United Kingdom,2
LARGE HEART MEASURING SPOONS,3.36,United Kingdom,2
FELT EGG COSY BLUE RABBIT ,1.66,United Kingdom,2
FELT EGG COSY CHICKEN,1.66,United Kingdom,2
OFFICE MUG WARMER BLACK+SILVER ,5.91,United Kingdom,2
HEART DECORATION PAINTED ZINC ,1.28,United Kingdom,2
DOVE DECORATION PAINTED ZINC ,1.28,United Kingdom,2
GLASS JAR DAISY FRESH COTTON WOOL,5.91,United Kingdom,2
10 COLOUR SPACEBOY PEN,1.66,United Kingdom,2
HANGING METAL HEART LANTERN,3.36,United Kingdom,2
FAIRY TALE COTTAGE NIGHTLIGHT,4.21,United Kingdom,2
TV DINNER TRAY VINTAGE PAISLEY,11.02,United Kingdom,2
MEMO BOARD COTTAGE DESIGN,11.02,United Kingdom,2
MINI JIGSAW BUNNIES,0.85,United Kingdom,2
HOLIDAY FUN LUDO,7.62,United Kingdom,2
PLASTERS IN TIN SKULLS,3.36,United Kingdom,2
FELTCRAFT CUSHION RABBIT,7.62,United Kingdom,2
HEART WOODEN CHRISTMAS DECORATION,1.66,United Kingdom,2
WOOD STOCKING CHRISTMAS SCANDISPOT,1.66,United Kingdom,2
PACK OF 6 PANNETONE GIFT BOXES,5.06,United Kingdom,2
PACK OF 12 SPACEBOY TISSUES,0.85,United Kingdom,2
PACK OF 12 LONDON TISSUES ,0.85,United Kingdom,2
TRADITIONAL KNITTING NANCY,3.36,United Kingdom,2
BOX OF VINTAGE JIGSAW BLOCKS ,11.02,United Kingdom,2
IVORY KITCHEN SCALES,16.98,United Kingdom,2
LUNCH BOX I LOVE LONDON,4.21,United Kingdom,2
FRENCH BLUE METAL DOOR SIGN No,2.51,United Kingdom,2
RIBBON REEL SNOWY VILLAGE,3.36,United Kingdom,2
FELTCRAFT PRINCESS OLIVIA DOLL,7.62,United Kingdom,2
SMALL RED BABUSHKA NOTEBOOK ,1.66,United Kingdom,2
SMALL PURPLE BABUSHKA NOTEBOOK ,1.66,United Kingdom,2
SET OF 3 NOTEBOOKS IN PARCEL,3.36,United Kingdom,2
T-LIGHT HOLDER SWEETHEART HANGING,4.21,United Kingdom,2
CARD PSYCHEDELIC APPLES,0.85,United Kingdom,2
CARD MOTORBIKE SANTA,0.85,United Kingdom,2
HOT WATER BOTTLE BABUSHKA ,9.32,United Kingdom,2
SET 20 NAPKINS FAIRY CAKES DESIGN ,1.66,United Kingdom,2
CHILDRENS APRON APPLES DESIGN,4.21,United Kingdom,2
 SET 2 TEA TOWELS I LOVE LONDON ,5.91,United Kingdom,2
CHRISTMAS LIGHTS 10 SANTAS ,8.47,United Kingdom,2
60 CAKE CASES DOLLY GIRL DESIGN,1.28,United Kingdom,2
SPACEBOY CHILDRENS EGG CUP,2.51,United Kingdom,2
FOLKART ZINC HEART CHRISTMAS DEC,1.66,United Kingdom,2
FOLKART HEART NAPKIN RINGS,3.36,United Kingdom,2
TEA TIME TEA SET IN GIFT BOX,14.43,United Kingdom,2
WOVEN BERRIES CUSHION COVER ,4.21,United Kingdom,2
4 IVORY DINNER CANDLES SILVER FLOCK,3.36,United Kingdom,2
PAINTED LIGHTBULB STAR+ MOON,0.84,United Kingdom,2
PAINTED LIGHTBULB RAINBOW DESIGN,0.84,United Kingdom,2
KITCHEN METAL SIGN,1.28,United Kingdom,2
ENGLISH ROSE HOT WATER BOTTLE,8.47,United Kingdom,2
YELLOW METAL CHICKEN HEART ,3.36,United Kingdom,2
BLUE NEW BAROQUE CANDLESTICK CANDLE,5.91,United Kingdom,2
BOX OF 24 COCKTAIL PARASOLS,0.85,United Kingdom,2
JUNGLE POPSICLES ICE LOLLY HOLDERS,2.51,United Kingdom,2
SOFT PINK ROSE TOWEL ,3.36,United Kingdom,2
SINGLE HEART ZINC T-LIGHT HOLDER,2.13,United Kingdom,2
60 TEATIME FAIRY CAKE CASES,1.28,United Kingdom,2
BLACK CANDELABRA T-LIGHT HOLDER,1.66,United Kingdom,2
HAND OVER THE CHOCOLATE   SIGN ,4.21,United Kingdom,2
SET/6 EAU DE NIL BIRD T-LIGHTS,4.21,United Kingdom,2
SMALL HANGING IVORY/RED WOOD BIRD,0.85,United Kingdom,2
CINAMMON SET OF 9 T-LIGHTS,1.66,United Kingdom,2
ORANGE SCENTED SET/9 T-LIGHTS,1.66,United Kingdom,2
COPPER/OLIVE GREEN FLOWER NECKLACE,6.37,United Kingdom,2
MIDNIGHT BLUE VINTAGE EARRINGS,3.81,United Kingdom,2
NECKLACE+BRACELET SET BLUE HIBISCUS,5.06,United Kingdom,2
BLUE POLKADOT CUP,2.51,United Kingdom,2
CHICK GREY HOT WATER BOTTLE,8.47,United Kingdom,2
DOORMAT SPOTTY HOME SWEET HOME,16.98,United Kingdom,2
RIBBON REEL STRIPES DESIGN ,4.21,United Kingdom,2
10 COLOUR SPACEBOY PEN,2.51,United Kingdom,2
DOORMAT WELCOME TO OUR HOME,16.98,United Kingdom,2
WICKER STAR ,5.06,United Kingdom,2
ALARM CLOCK BAKELIKE ORANGE,8.47,United Kingdom,2
ALARM CLOCK BAKELIKE IVORY,8.47,United Kingdom,2
3D TRADITIONAL CHRISTMAS STICKERS,3.36,United Kingdom,2
RIBBON REEL SNOWY VILLAGE,4.21,United Kingdom,2
PACK 3 BOXES CHRISTMAS PANNETONE,5.06,United Kingdom,2
TEA TIME DES TEA COSY,5.91,United Kingdom,2
60 TEATIME FAIRY CAKE CASES,2.13,United Kingdom,2
PINK POLKADOT BOWL,3.36,United Kingdom,2
EDWARDIAN PARASOL NATURAL,12.72,United Kingdom,2
EDWARDIAN PARASOL RED,12.72,United Kingdom,2
LUNCH BAG RED RETROSPOT,5.06,United Kingdom,2
RETROSPOT CHILDRENS APRON,4.21,United Kingdom,2
WHITE BELL HONEYCOMB PAPER ,3.36,United Kingdom,2
"SET 3 RETROSPOT TEA,COFFEE,SUGAR",11.02,United Kingdom,2
RED SPOTTY BISCUIT TIN,8.47,United Kingdom,2
I CAN ONLY PLEASE ONE PERSON MUG,3.36,United Kingdom,2
WOODEN BOX OF DOMINOES,3.36,United Kingdom,2
CHRISTMAS CRAFT LITTLE FRIENDS,4.21,United Kingdom,2
GREEN CHRISTMAS TREE CARD HOLDER,8.47,United Kingdom,2
SMALL HEART MEASURING SPOONS,1.66,United Kingdom,2
OVERNIGHT BAG VINTAGE ROSE PAISLEY,11.02,United Kingdom,2
JUMBO BAG PINK POLKADOT,5.06,United Kingdom,2
HEART OF WICKER SMALL,4.21,United Kingdom,2
SPACEBOY TV DINNER TRAY,11.02,United Kingdom,2
RECIPE BOX BLUE SKETCHBOOK DESIGN,5.91,United Kingdom,2
TEA TIME PARTY BUNTING,8.47,United Kingdom,2
BATHROOM METAL SIGN,1.28,United Kingdom,2
CACTI T-LIGHT CANDLES,13.57,United Kingdom,2
WHITE BELL HONEYCOMB PAPER ,3.36,United Kingdom,2
RED SPOTTY BISCUIT TIN,8.47,United Kingdom,2
VICTORIAN SEWING BOX LARGE,25.49,United Kingdom,2
RED GINGHAM ROSE JEWELLERY BOX,3.36,United Kingdom,2
RED WHITE SCARF  HOT WATER BOTTLE,8.47,United Kingdom,2
ROTATING LEAVES T-LIGHT HOLDER,5.91,United Kingdom,2
STRAWBERRY LUNCH BOX WITH CUTLERY,5.06,United Kingdom,2
PIZZA PLATE IN BOX,7.62,United Kingdom,2
CHRISTMAS CRAFT TREE TOP ANGEL,4.21,United Kingdom,2
METAL 4 HOOK HANGER FRENCH CHATEAU,5.91,United Kingdom,2
SET 10 LIGHTS NIGHT OWL,13.57,United Kingdom,2
OVERNIGHT BAG VINTAGE ROSE PAISLEY,11.02,United Kingdom,2
LUNCH BOX WITH CUTLERY RETROSPOT ,5.06,United Kingdom,2
NATURAL SLATE CHALKBOARD LARGE ,10.17,United Kingdom,2
ROSES REGENCY TEACUP AND SAUCER ,5.91,United Kingdom,2
WOODEN ADVENT CALENDAR CREAM,34,United Kingdom,2
RETRO COFFEE MUGS ASSORTED,16.13,United Kingdom,2
PARTY BUNTING,9.32,United Kingdom,2
SMALL LICORICE DES PINK BOWL,2.51,United Kingdom,2
ANTIQUE SILVER TEA GLASS ETCHED,2.51,United Kingdom,2
PINK POLKADOT CHILDRENS UMBRELLA,6.77,United Kingdom,2
BOX OF 9 PEBBLE CANDLES,4.21,United Kingdom,2
PLEASE ONE PERSON METAL SIGN,4.21,United Kingdom,2
GIN + TONIC DIET METAL SIGN,4.21,United Kingdom,2
RED SPOTTY BISCUIT TIN,8.47,United Kingdom,2
VICTORIAN SEWING BOX LARGE,25.49,United Kingdom,2
SKULL LUNCH BOX WITH CUTLERY ,5.06,United Kingdom,2
POLKADOT RAIN HAT ,0.81,United Kingdom,2
CHOCOLATE CALCULATOR,3.36,United Kingdom,2
GIN AND TONIC MUG,3.36,United Kingdom,2
CHRISTMAS CRAFT LITTLE FRIENDS,4.21,United Kingdom,2
METAL 4 HOOK HANGER FRENCH CHATEAU,5.91,United Kingdom,2
FRYING PAN UNION FLAG,8.47,United Kingdom,2
COFFEE MUG CAT + BIRD DESIGN,5.06,United Kingdom,2
JUMBO BAG PINK POLKADOT,5.06,United Kingdom,2
BABUSHKA LIGHTS STRING OF 10,13.57,United Kingdom,2
CHILDS GARDEN BRUSH BLUE,4.21,United Kingdom,2
CHILDS GARDEN BRUSH PINK,4.21,United Kingdom,2
RED KITCHEN SCALES,16.98,United Kingdom,2
RECIPE BOX PANTRY YELLOW DESIGN,5.91,United Kingdom,2
GUMBALL MONOCHROME COAT RACK,2.51,United Kingdom,2
SET 7 BABUSHKA NESTING BOXES,16.98,United Kingdom,2
SMALL RED BABUSHKA NOTEBOOK ,1.66,United Kingdom,2
RETRO COFFEE MUGS ASSORTED,16.13,United Kingdom,2
SET/6 TURQUOISE BUTTERFLY T-LIGHTS,4.21,United Kingdom,2
HAND TOWEL PINK FLOWER AND DAISY,11.87,United Kingdom,2
SET/2 RED RETROSPOT TEA TOWELS ,5.91,United Kingdom,2
RED RETROSPOT OVEN GLOVE DOUBLE,5.91,United Kingdom,2
EDWARDIAN PARASOL BLACK,12.72,United Kingdom,2
RED RETROSPOT OVEN GLOVE DOUBLE,5.91,United Kingdom,2
COOK WITH WINE METAL SIGN ,4.21,United Kingdom,2
"SET 3 RETROSPOT TEA,COFFEE,SUGAR",11.02,United Kingdom,2
RED RETROSPOT ROUND CAKE TINS,21.23,United Kingdom,2
SET OF 6 FUNKY BEAKERS,5.74,United Kingdom,2
BIG DOUGHNUT FRIDGE MAGNETS,8.47,United Kingdom,2
POLKADOT RAIN HAT ,0.81,United Kingdom,2
MAN FLU METAL SIGN,4.21,United Kingdom,2
SUKI  SHOULDER BAG,4.21,United Kingdom,2
CHRISTMAS CRAFT TREE TOP ANGEL,4.21,United Kingdom,2
WALL MIRROR RECTANGLE DIAMANTE PINK,16.13,United Kingdom,2
SET 10 LIGHTS NIGHT OWL,13.57,United Kingdom,2
JUMBO BAG SPACEBOY DESIGN,5.06,United Kingdom,2
ENAMEL MEASURING JUG CREAM,8.47,United Kingdom,2
HEART OF WICKER SMALL,4.21,United Kingdom,2
DOLLY GIRL LUNCH BOX,2.51,United Kingdom,2
ROSES REGENCY TEACUP AND SAUCER ,5.91,United Kingdom,2
3 TIER CAKE TIN RED AND CREAM,29.79,United Kingdom,2
TEA FOR ONE POLKADOT,8.47,United Kingdom,2
PEG BAG APPLES DESIGN,5.06,United Kingdom,2
SMALL DOLLY MIX DESIGN ORANGE BOWL,2.51,United Kingdom,2
6 RIBBONS RUSTIC CHARM,1.65,United Kingdom,2
PACK OF 6 BIRDY GIFT TAGS,1.25,United Kingdom,2
HERB MARKER MINT,0.65,United Kingdom,2
HERB MARKER THYME,0.65,United Kingdom,2
HERB MARKER CHIVES ,0.65,United Kingdom,2
HERB MARKER BASIL,0.65,United Kingdom,2
HERB MARKER PARSLEY,0.65,United Kingdom,2
ENCHANTED BIRD COATHANGER 5 HOOK,4.65,United Kingdom,2
LANTERN CREAM GAZEBO ,4.95,United Kingdom,2
IVORY GIANT GARDEN THERMOMETER,5.95,United Kingdom,2
GARLAND WITH STARS AND BELLS,4.95,United Kingdom,2
POTTING SHED TEA MUG,1.25,United Kingdom,2
COOK WITH WINE METAL SIGN ,1.95,United Kingdom,2
YOU'RE CONFUSING ME METAL SIGN ,1.69,United Kingdom,2
MAN FLU METAL SIGN,2.1,United Kingdom,2
CREAM HEART CARD HOLDER,3.95,United Kingdom,2
IVORY DINER WALL CLOCK,8.5,United Kingdom,2
SWEETHEART WIRE MAGAZINE RACK,7.95,United Kingdom,2
RED SHARK HELICOPTER,7.95,United Kingdom,2
VINTAGE CREAM CAT FOOD CONTAINER,6.35,United Kingdom,2
EUCALYPTUS & PINECONE  WREATH,6.75,United Kingdom,2
DOORMAT NEW ENGLAND,7.95,United Kingdom,2
WHITE STITCHED CUSHION COVER,6.95,United Kingdom,2
WHITE STITCHED CUSHION COVER,6.95,United Kingdom,2
12 PENCILS TALL TUBE SKULLS,0.85,United Kingdom,2
IVORY EMBROIDERED QUILT ,39.95,United Kingdom,2
IVORY KITCHEN SCALES,8.5,United Kingdom,2
GREEN DRAWER KNOB ACRYLIC EDWARDIAN,1.25,United Kingdom,2
PINK DRAWER KNOB ACRYLIC EDWARDIAN,1.25,United Kingdom,2
CHOCOLATE CALCULATOR,1.65,United Kingdom,2
ENAMEL MEASURING JUG CREAM,4.25,United Kingdom,2
HAND WARMER BABUSHKA DESIGN,2.1,United Kingdom,2
HI TEC ALPINE HAND WARMER,1.65,United Kingdom,2
ILLUSTRATED CAT BOWL ,2.55,United Kingdom,2
CIRCUS PARADE CHILDRENS EGG CUP ,1.25,United Kingdom,2
SOLDIERS EGG CUP ,1.25,United Kingdom,2
SET/3 FLORAL GARDEN TOOLS IN BAG,7.95,United Kingdom,2
TIGRIS EYE CHUNKY CHARM BRACELET,8.95,United Kingdom,2
WASH BAG VINTAGE ROSE PAISLEY,5.91,United Kingdom,2
HEART FILIGREE DOVE  SMALL,2.51,United Kingdom,2
HEART IVORY TRELLIS LARGE,3.36,United Kingdom,2
HEART IVORY TRELLIS SMALL,2.51,United Kingdom,2
HEART DECORATION PAINTED ZINC ,1.28,United Kingdom,2
KINGS CHOICE TEA CADDY ,5.91,United Kingdom,2
WALL TIDY RETROSPOT ,4.21,United Kingdom,2
JUMBO BAG PINK POLKADOT,4.21,United Kingdom,2
PAPERWEIGHT VINTAGE COLLAGE,5.06,United Kingdom,2
TOOTHPASTE TUBE PEN,1.28,United Kingdom,2
SET OF 9 HEART SHAPED BALLOONS,2.51,United Kingdom,2
EMBOSSED GLASS TEALIGHT HOLDER,2.51,United Kingdom,2
EMPIRE UNION JACK TV DINNER TRAY,11.02,United Kingdom,2
DOORSTOP RETROSPOT HEART,7.62,United Kingdom,2
MINI JIGSAW SPACEBOY,0.85,United Kingdom,2
PICTURE DOMINOES,3.36,United Kingdom,2
PLASTERS IN TIN SKULLS,3.36,United Kingdom,2
CLOTHES PEGS RETROSPOT PACK 24 ,2.51,United Kingdom,2
FELTCRAFT CUSHION BUTTERFLY,7.62,United Kingdom,2
PACK OF 6 BIRDY GIFT TAGS,2.51,United Kingdom,2
CARD HOLDER GINGHAM HEART,5.06,United Kingdom,2
CHRISTMAS RETROSPOT HEART WOOD,1.66,United Kingdom,2
PACK OF 12 SPACEBOY TISSUES,0.85,United Kingdom,2
SET OF 6 SOLDIER SKITTLES,7.62,United Kingdom,2
4 TRADITIONAL SPINNING TOPS,2.51,United Kingdom,2
SPACEBOY LUNCH BOX ,4.21,United Kingdom,2
DOLLY GIRL LUNCH BOX,4.21,United Kingdom,2
CERAMIC STRAWBERRY CAKE MONEY BANK,3.36,United Kingdom,2
STRAWBERRY FAIRY CAKE TEAPOT,11.02,United Kingdom,2
GENTLEMAN SHIRT REPAIR KIT ,1.66,United Kingdom,2
DELUXE SEWING KIT ,11.87,United Kingdom,2
GREEN REGENCY TEACUP AND SAUCER,5.91,United Kingdom,2
ALARM CLOCK BAKELIKE PINK,7.62,United Kingdom,2
3D CHRISTMAS STAMPS STICKERS ,2.51,United Kingdom,2
RIBBON REEL SNOWY VILLAGE,3.36,United Kingdom,2
SMALL YELLOW BABUSHKA NOTEBOOK ,1.66,United Kingdom,2
SMALL PURPLE BABUSHKA NOTEBOOK ,1.66,United Kingdom,2
T-LIGHT GLASS FLUTED ANTIQUE,2.51,United Kingdom,2
FLUTED ANTIQUE CANDLE HOLDER,1.66,United Kingdom,2
ANTIQUE GLASS PEDESTAL BOWL,7.62,United Kingdom,2
MINI CAKE STAND T-LIGHT HOLDER,0.85,United Kingdom,2
HERB MARKER THYME,1.66,United Kingdom,2
HERB MARKER ROSEMARY,1.66,United Kingdom,2
HERB MARKER PARSLEY,1.66,United Kingdom,2
HERB MARKER BASIL,1.66,United Kingdom,2
HERB MARKER CHIVES ,1.66,United Kingdom,2
SET OF 3 BIRD LIGHT PINK FEATHER ,2.51,United Kingdom,2
SMALLFOLKART BAUBLE CHRISTMAS DEC,1.66,United Kingdom,2
RETRO COFFEE MUGS ASSORTED,16.13,United Kingdom,2
YELLOW BREAKFAST CUP AND SAUCER,5.91,United Kingdom,2
HI TEC ALPINE HAND WARMER,3.36,United Kingdom,2
SILVER BOOK MARK WITH BEADS,2.51,United Kingdom,2
SET/6 PINK  BUTTERFLY T-LIGHTS,4.21,United Kingdom,2
LAUNDRY 15C METAL SIGN,2.51,United Kingdom,2
RED WOOLLY HOTTIE WHITE HEART.,7.62,United Kingdom,2
CHARLIE+LOLA RED HOT WATER BOTTLE ,4.21,United Kingdom,2
CHARLIE + LOLA RED HOT WATER BOTTLE,3.36,United Kingdom,2
WORLD WAR 2 GLIDERS ASSTD DESIGNS,0.43,United Kingdom,2
SET OF 3 BUTTERFLY COOKIE CUTTERS,2.51,United Kingdom,2
PINK NEW BAROQUECANDLESTICK CANDLE,5.91,United Kingdom,2
BLUE FLY SWAT,1.28,United Kingdom,2
ZINC WILLIE WINKIE  CANDLE STICK,1.66,United Kingdom,2
SCENTED CANDLE IN DIGITALIS TIN,4.21,United Kingdom,2
ANT WHITE WIRE HEART SPIRAL,8.47,United Kingdom,2
MINT GREEN ROSE TOWEL,3.36,United Kingdom,2
PINK BUTTERFLY HANDBAG W BOBBLES,4.21,United Kingdom,2
HANGING HEART ZINC T-LIGHT HOLDER,2.13,United Kingdom,2
SET OF 72 PINK HEART PAPER DOILIES,2.98,United Kingdom,2
72 SWEETHEART FAIRY CAKE CASES,1.28,United Kingdom,2
S/4 PINK FLOWER CANDLES IN BOWL,3.36,United Kingdom,2
FRENCH ENAMEL CANDLEHOLDER,4.21,United Kingdom,2
PEARL CRYSTAL PUMPKIN T-LIGHT HLDR,2.51,United Kingdom,2
CHARLIE + LOLA BISCUITS TINS,8.47,United Kingdom,2
RED SHARK HELICOPTER,8.47,United Kingdom,2
SET OF 6 3D KIT CARDS FOR KIDS,1.66,United Kingdom,2
SILVER M.O.P ORBIT BRACELET,5.51,United Kingdom,2
DAISY HAIR COMB,2.54,United Kingdom,2
JET BLACK LAS VEGAS NECKLACE 45CM,5.94,United Kingdom,2
LETTER "E" BLING KEY RING,0.85,United Kingdom,2
LETTER "G" BLING KEY RING,0.85,United Kingdom,2
LETTER "J" BLING KEY RING,0.85,United Kingdom,2
INFLATABLE POLITICAL GLOBE ,1.66,United Kingdom,2
KITTY PENCIL ERASERS,0.43,United Kingdom,2
GREEN POLKADOT BOWL,2.51,United Kingdom,2
STRAWBERRY CHARLOTTE BAG,1.66,United Kingdom,2
GOLD MINI TAPE MEASURE ,0.85,United Kingdom,2
RED FLOCK LOVE HEART PHOTO FRAME,1.66,United Kingdom,2
SET/5 RED RETROSPOT LID GLASS BOWLS,5.91,United Kingdom,2
12 PENCILS SMALL TUBE SKULL,1.28,United Kingdom,2
ANTIQUE ALL GLASS CANDLESTICK,2.51,United Kingdom,2
VINTAGE BILLBOARD DRINK ME MUG,2.51,United Kingdom,2
CREAM SLICE FLANNEL PINK SPOT ,5.91,United Kingdom,2
RED RETROSPOT OVEN GLOVE ,2.51,United Kingdom,2
EUCALYPTUS & PINECONE  WREATH,5.91,United Kingdom,2
IVORY HANGING DECORATION  HEART,1.66,United Kingdom,2
PERIWINKLE T-LIGHT HOLDER,2.51,United Kingdom,2
SAVE THE PLANET COTTON TOTE BAG,5.06,United Kingdom,2
RED SPOT CERAMIC DRAWER KNOB,2.51,United Kingdom,2
CITRONELLA CANDLE FLOWERPOT,4.21,United Kingdom,2
CITRONELLA CANDLE GARDEN POT,2.51,United Kingdom,2
RED TOADSTOOL LED NIGHT LIGHT,3.36,United Kingdom,2
VINTAGE SNAP CARDS,1.66,United Kingdom,2
VINTAGE HEADS AND TAILS CARD GAME ,2.51,United Kingdom,2
GARLAND WITH STARS AND BELLS,10.17,United Kingdom,2
PINK DIAMANTE PEN IN GIFT BOX,4.21,United Kingdom,2
POTTING SHED TEA MUG,3.36,United Kingdom,2
KINGS CHOICE MUG,3.36,United Kingdom,2
POTTERING MUG,3.36,United Kingdom,2
TRADITIONAL WOODEN SKIPPING ROPE,2.51,United Kingdom,2
TRADITIONAL WOODEN CATCH CUP GAME ,2.51,United Kingdom,2
PHARMACIE FIRST AID TIN,13.57,United Kingdom,2
VINTAGE SNAKES & LADDERS,7.62,United Kingdom,2
BLUE HARMONICA IN BOX ,2.51,United Kingdom,2
SET OF 6 STRAWBERRY CHOPSTICKS,2.51,United Kingdom,2
PACK OF 12 SKULL TISSUES,0.85,United Kingdom,2
PACK OF 60 PINK PAISLEY CAKE CASES,1.28,United Kingdom,2
PACK OF 12 PINK PAISLEY TISSUES ,0.85,United Kingdom,2
FULL ENGLISH BREAKFAST PLATE,7.62,United Kingdom,2
SCOTTIE DOG HOT WATER BOTTLE,11.02,United Kingdom,2
GREY HEART HOT WATER BOTTLE,7.62,United Kingdom,2
PARTY CONE CHRISTMAS DECORATION ,8.47,United Kingdom,2
CHRISTMAS CRAFT LITTLE FRIENDS,4.21,United Kingdom,2
3 STRIPEY MICE FELTCRAFT,4.21,United Kingdom,2
HEART DECORATION RUSTIC HANGING ,0.81,United Kingdom,2
CREAM HEART CARD HOLDER,8.47,United Kingdom,2
LOCAL CAFE MUG,2.51,United Kingdom,2
FOUR HOOK  WHITE LOVEBIRDS,4.21,United Kingdom,2
MIRRORED DISCO BALL ,5.95,United Kingdom,2
IVORY DINER WALL CLOCK,8.5,United Kingdom,2
WOOD S/3 CABINET ANT WHITE FINISH,7.95,United Kingdom,2
FAMILY PHOTO FRAME CORNICE,9.95,United Kingdom,2
RED RETROSPOT TRADITIONAL TEAPOT ,7.95,United Kingdom,2
TRIPLE PHOTO FRAME CORNICE ,9.95,United Kingdom,2
RED RETROSPOT ROUND CAKE TINS,9.95,United Kingdom,2
3 TIER CAKE TIN RED AND CREAM,14.95,United Kingdom,2
REGENCY CAKESTAND 3 TIER,12.75,United Kingdom,2
PACK OF 60 DINOSAUR CAKE CASES,0.55,United Kingdom,2
DOORMAT TOPIARY,7.95,United Kingdom,2
RED KITCHEN SCALES,8.5,United Kingdom,2
BLACK KITCHEN SCALES,8.5,United Kingdom,2
3 HOOK PHOTO SHELF ANTIQUE WHITE,8.5,United Kingdom,2
WOOD S/3 CABINET ANT WHITE FINISH,7.95,United Kingdom,2
CHILDS BREAKFAST SET DOLLY GIRL ,9.95,United Kingdom,2
BIG DOUGHNUT FRIDGE MAGNETS,0.85,United Kingdom,2
BAKING MOULD CHOCOLATE CUPCAKES,2.55,United Kingdom,2
PACK OF 60 MUSHROOM CAKE CASES,0.55,United Kingdom,2
"AIRLINE LOUNGE,METAL SIGN",2.1,United Kingdom,2
CHRISTMAS LIGHTS 10 REINDEER,8.5,United Kingdom,2
BAKING MOULD HEART WHITE CHOCOLATE,2.55,United Kingdom,2
BAKING MOULD HEART MILK CHOCOLATE,2.55,United Kingdom,2
SET OF 3 HEART COOKIE CUTTERS,1.25,United Kingdom,2
3 TRADITIONAl BISCUIT CUTTERS  SET,2.1,United Kingdom,2
CHILDS BREAKFAST SET CIRCUS PARADE,8.5,United Kingdom,2
REGENCY CAKESTAND 3 TIER,12.75,United Kingdom,2
SWEETHEART CAKESTAND 3 TIER,9.95,United Kingdom,2
CERAMIC CAKE STAND + HANGING CAKES,9.95,United Kingdom,2
RED RETROSPOT SUGAR JAM BOWL,2.55,United Kingdom,2
RETROSPOT TEA SET CERAMIC 11 PC ,4.95,United Kingdom,2
SET OF 36 TEATIME PAPER DOILIES,1.45,United Kingdom,2
STRAWBERRY FAIRY CAKE TEAPOT,4.95,United Kingdom,2
MINI CAKE STAND WITH HANGING CAKES,1.45,United Kingdom,2
SMALL WHITE RETROSPOT MUG IN BOX ,3.75,United Kingdom,2
SWEETHEART RECIPE BOOK STAND,6.75,United Kingdom,2
CHRISTMAS LIGHTS 10 SANTAS ,8.5,United Kingdom,2
15CM CHRISTMAS GLASS BALL 20 LIGHTS,7.95,United Kingdom,2
GROW YOUR OWN FLOWERS SET OF 3,7.95,United Kingdom,2
GROW YOUR OWN HERBS SET OF 3,7.95,United Kingdom,2
ZINC METAL HEART DECORATION,1.25,United Kingdom,2
GLASS JAR ENGLISH CONFECTIONERY,2.95,United Kingdom,2
CHRISTMAS PUDDING TRINKET POT ,1.45,United Kingdom,2
LETTER "S" BLING KEY RING,1.25,United Kingdom,2
BLACK EAR MUFF HEADPHONES,5.49,United Kingdom,2
TEA BAG PLATE RED RETROSPOT,0.85,United Kingdom,2
EDWARDIAN PARASOL BLACK,5.95,United Kingdom,2
WOODEN FRAME ANTIQUE WHITE ,2.95,United Kingdom,2
WOODEN PICTURE FRAME WHITE FINISH,2.55,United Kingdom,2
WHITE HANGING HEART T-LIGHT HOLDER,2.95,United Kingdom,2
ROUND PINK HEART MIRROR,2.1,United Kingdom,2
HEART DECORATION WITH PEARLS ,0.85,United Kingdom,2
HAND WARMER BIRD DESIGN,2.1,United Kingdom,2
WHITE HANGING BEADS CANDLE HOLDER,5.45,United Kingdom,2
WOODEN BOX OF DOMINOES,1.25,United Kingdom,2
SET 7 BABUSHKA NESTING BOXES,8.5,United Kingdom,2
 SET 2 TEA TOWELS I LOVE LONDON ,2.95,United Kingdom,2
PACK OF 72 RETROSPOT CAKE CASES,0.55,United Kingdom,2
CHILDRENS APRON APPLES DESIGN,1.95,United Kingdom,2
TOTE BAG I LOVE LONDON,2.1,United Kingdom,2
HAND WARMER BIRD DESIGN,2.1,United Kingdom,2
CHILDS BREAKFAST SET CIRCUS PARADE,8.5,United Kingdom,2
SPACEBOY LUNCH BOX ,1.95,United Kingdom,2
PACK OF 20 NAPKINS RED APPLES,0.85,United Kingdom,2
PINK PAISLEY CUSHION COVER ,5.95,United Kingdom,2
SET/20 RED RETROSPOT PAPER NAPKINS ,0.85,United Kingdom,2
REX CASH+CARRY JUMBO SHOPPER,0.95,United Kingdom,2
WOODLAND DESIGN  COTTON TOTE BAG,2.25,United Kingdom,2
TRADITIONAL WOODEN SKIPPING ROPE,1.25,United Kingdom,2
3 STRIPEY MICE FELTCRAFT,1.95,United Kingdom,2
BUTTONS AND STRIPES NOTEBOOK ,3.75,United Kingdom,2
LUNCH BAG WOODLAND,1.65,United Kingdom,2
EDWARDIAN PARASOL NATURAL,5.95,United Kingdom,2
FELTCRAFT CUSHION BUTTERFLY,3.75,United Kingdom,2
CHRISTMAS CRAFT LITTLE FRIENDS,2.1,United Kingdom,2
CHRISTMAS CRAFT WHITE FAIRY ,1.45,United Kingdom,2
TRADITIONAL WOODEN SKIPPING ROPE,1.25,United Kingdom,2
LUNCH BAG RED RETROSPOT,1.65,United Kingdom,2
PLASTERS IN TIN WOODLAND ANIMALS,1.65,United Kingdom,2
IVORY GIANT GARDEN THERMOMETER,5.95,United Kingdom,2
ROUND SNACK BOXES SET OF4 WOODLAND ,2.95,United Kingdom,2
HEART OF WICKER SMALL,1.65,United Kingdom,2
DOORMAT FANCY FONT HOME SWEET HOME,7.95,United Kingdom,2
DOORMAT RED RETROSPOT,7.95,United Kingdom,2
RED RETROSPOT BIG BOWL,4.95,United Kingdom,2
10 COLOUR SPACEBOY PEN,0.85,United Kingdom,2
HEADS AND TAILS SPORTING FUN,1.25,United Kingdom,2
HAND WARMER BABUSHKA DESIGN,2.1,United Kingdom,2
HAND WARMER BIRD DESIGN,2.1,United Kingdom,2
HOT WATER BOTTLE TEA AND SYMPATHY,3.95,United Kingdom,2
12 PENCIL SMALL TUBE WOODLAND,0.65,United Kingdom,2
WOOD STAMP SET FLOWERS,1.65,United Kingdom,2
PLASTERS IN TIN WOODLAND ANIMALS,1.65,United Kingdom,2
HAND WARMER BIRD DESIGN,2.1,United Kingdom,2
PACK OF 6 BIRDY GIFT TAGS,1.25,United Kingdom,2
ANTIQUE GLASS HEART DECORATION ,1.95,United Kingdom,2
HEART FILIGREE DOVE  SMALL,1.25,United Kingdom,2
4 IVORY DINNER CANDLES SILVER FLOCK,2.55,United Kingdom,2
APPLE BATH SPONGE,1.25,United Kingdom,2
CERAMIC HEART FAIRY CAKE MONEY BANK,1.45,United Kingdom,2
STAR PORTABLE TABLE LIGHT ,2.95,United Kingdom,2
STRAWBERRY SHOPPER BAG,1.25,United Kingdom,2
CHRISTMAS CRAFT LITTLE FRIENDS,2.1,United Kingdom,2
EASTER DECORATION NATURAL CHICK,0.65,United Kingdom,2
HAND WARMER BIRD DESIGN,2.1,United Kingdom,2
ASSORTED COLOUR SUCTION CUP HOOK,0.19,United Kingdom,2
ASSORTED COLOUR SUCTION CUP HOOK,0.19,United Kingdom,2
PAPER CHAIN KIT LONDON,2.95,United Kingdom,2
LUNCH BAG RED RETROSPOT,1.65,United Kingdom,2
PARTY FOOD SHOPPER BAG,1.25,United Kingdom,2
DOORMAT RED RETROSPOT,7.95,United Kingdom,2
WOOD 2 DRAWER CABINET WHITE FINISH,5.95,United Kingdom,2
WOOD S/3 CABINET ANT WHITE FINISH,7.95,United Kingdom,2
WOODEN FRAME ANTIQUE WHITE ,2.95,United Kingdom,2
WOODEN PICTURE FRAME WHITE FINISH,2.55,United Kingdom,2
PHOTO FRAME CORNICE,2.95,United Kingdom,2
