Description,UnitPrice,Country,Quantity
HI TEC ALPINE HAND WARMER,1.65,United Kingdom,6
CHRISTMAS CRAFT TREE TOP ANGEL,2.1,United Kingdom,6
PEACE WOODEN BLOCK LETTERS,6.95,EIRE,6
MINT KITCHEN SCALES,8.5,EIRE,6
RED WOOLLY HOTTIE WHITE HEART.,3.75,United Kingdom,6
BLACK AND WHITE DOG BOWL,2.95,United Kingdom,6
6 CHOCOLATE LOVE HEART T-LIGHTS,2.1,United Kingdom,6
CINAMMON SET OF 9 T-LIGHTS,0.85,United Kingdom,6
SCOTTIES CHILDRENS APRON,1.65,United Kingdom,6
CHILDRENS APRON SPACEBOY DESIGN,1.95,United Kingdom,6
ROTATING SILVER ANGELS T-LIGHT HLDR,2.55,United Kingdom,6
BOX OF 24 COCKTAIL PARASOLS,0.42,United Kingdom,6
PAPER CHAIN KIT 50'S CHRISTMAS ,2.95,United Kingdom,6
ROCKING HORSE GREEN CHRISTMAS ,0.85,United Kingdom,6
SET OF 6 T-LIGHTS SNOWMEN,2.95,United Kingdom,6
YELLOW COAT RACK PARIS FASHION,4.95,United Kingdom,6
PAPER CHAIN KIT 50'S CHRISTMAS ,2.95,United Kingdom,6
ROSES REGENCY TEACUP AND SAUCER ,2.95,United Kingdom,6
GREEN REGENCY TEACUP AND SAUCER,2.95,United Kingdom,6
NATURAL SLATE HEART CHALKBOARD ,2.95,United Kingdom,6
HEART OF WICKER LARGE,2.95,United Kingdom,6
HAND WARMER OWL DESIGN,2.1,United Kingdom,6
ANTIQUE SILVER TEA GLASS ETCHED,1.25,United Kingdom,6
CHRISTMAS CRAFT WHITE FAIRY ,1.45,United Kingdom,6
36 FOIL HEART CAKE CASES,2.1,United Kingdom,6
36 FOIL STAR CAKE CASES ,2.1,United Kingdom,6
SKULL LUNCH BOX WITH CUTLERY ,2.55,United Kingdom,6
LUNCH BOX WITH CUTLERY RETROSPOT ,2.55,United Kingdom,6
RED RETROSPOT CUP,0.85,United Kingdom,6
STRAWBERRY LUNCH BOX WITH CUTLERY,2.55,United Kingdom,6
JUMBO BAG RED RETROSPOT,1.95,United Kingdom,6
STRAWBERRY RAFFIA FOOD COVER,3.75,United Kingdom,6
BLACK/BLUE POLKADOT UMBRELLA,5.95,United Kingdom,6
JAM MAKING SET WITH JARS,4.25,United Kingdom,6
HAND WARMER UNION JACK,2.1,United Kingdom,6
REGENCY CAKESTAND 3 TIER,12.75,United Kingdom,6
PEARL CRYSTAL PUMPKIN T-LIGHT HLDR,1.65,United Kingdom,6
COFFEE MUG CAT + BIRD DESIGN,2.55,United Kingdom,6
BUTTERFLIES STICKERS,0.85,United Kingdom,6
HEARTS  STICKERS,0.85,United Kingdom,6
VANILLA SCENT CANDLE JEWELLED BOX,4.25,United Kingdom,6
COFFEE MUG CAT + BIRD DESIGN,2.55,United Kingdom,6
WOODEN FRAME ANTIQUE WHITE ,2.95,United Kingdom,6
GREEN POP ART MAO CUSHION COVER ,0.19,United Kingdom,6
WHITE HANGING HEART T-LIGHT HOLDER,2.95,United Kingdom,6
LADS ONLY TISSUE BOX,1.25,United Kingdom,6
MOTORING TISSUE BOX,1.25,United Kingdom,6
FILIGRIS HEART WITH BUTTERFLY,1.25,United Kingdom,6
CHARLOTTE BAG SUKI DESIGN,0.85,United Kingdom,6
TEA TIME DES TEA COSY,2.55,United Kingdom,6
WHITE GOOSE FEATHER CHRISTMAS TREE ,2.95,United Kingdom,6
VANILLA SCENT CANDLE JEWELLED BOX,4.25,United Kingdom,6
JAM MAKING SET WITH JARS,4.25,United Kingdom,6
36 FOIL HEART CAKE CASES,2.1,United Kingdom,6
BISCUIT TIN VINTAGE RED,6.75,United Kingdom,6
WOODLAND  STICKERS,0.85,United Kingdom,6
GARLAND WITH HEARTS AND BELLS,4.95,United Kingdom,6
SILVER HANGING T-LIGHT HOLDER,1.65,United Kingdom,6
JAM MAKING SET WITH JARS,4.25,United Kingdom,6
WHITE HANGING HEART T-LIGHT HOLDER,2.95,United Kingdom,6
HAND OVER THE CHOCOLATE   SIGN ,2.1,United Kingdom,6
NATURAL SLATE CHALKBOARD LARGE ,4.95,United Kingdom,6
WOODLAND CHARLOTTE BAG,0.85,United Kingdom,6
SMALL GLASS HEART TRINKET POT,4.21,United Kingdom,6
BLUE HARMONICA IN BOX ,2.51,United Kingdom,6
RED  HARMONICA IN BOX ,2.51,United Kingdom,6
FLORAL FOLK STATIONERY SET,2.51,United Kingdom,6
PHOTO CUBE,3.36,United Kingdom,6
WOODEN TREE CHRISTMAS SCANDINAVIAN,1.66,United Kingdom,6
HAND WARMER RED RETROSPOT,2.1,United Kingdom,6
CLEAR DRAWER KNOB ACRYLIC EDWARDIAN,2.51,United Kingdom,6
60 CAKE CASES VINTAGE CHRISTMAS,1.28,United Kingdom,6
ASSTD DESIGN BUBBLE GUM RING,0.21,United Kingdom,6
ENGLISH ROSE NOTEBOOK A7 SIZE,0.85,United Kingdom,6
WHITE TRAVEL ALARM CLOCK,2.51,United Kingdom,6
S/15 SILVER GLASS BAUBLES IN BAG,2.51,United Kingdom,6
SLEEPING CAT ERASERS,0.43,United Kingdom,6
HOME SWEET HOME MUG,1.25,United Kingdom,6
KINGS CHOICE MUG,1.25,United Kingdom,6
VINTAGE BILLBOARD TEA MUG,1.25,United Kingdom,6
VINTAGE BILLBOARD DRINK ME MUG,1.25,United Kingdom,6
RED TEA TOWEL CLASSIC DESIGN,1.25,United Kingdom,6
KINGS CHOICE MUG,1.25,United Kingdom,6
ROSE SCENT CANDLE IN JEWELLED BOX,4.25,United Kingdom,6
BEWARE OF THE CAT METAL SIGN ,1.69,United Kingdom,6
SALLE DE BAIN HOOK,1.25,United Kingdom,6
SET OF 6 T-LIGHTS WEDDING CAKE ,2.95,United Kingdom,6
VINTAGE SNAP CARDS,0.85,United Kingdom,6
I CAN ONLY PLEASE ONE PERSON MUG,1.25,United Kingdom,6
GLAMOROUS  MUG,1.25,United Kingdom,6
POTTERING MUG,1.25,United Kingdom,6
GIN AND TONIC MUG,1.25,United Kingdom,6
FIVE HEART HANGING DECORATION,2.95,United Kingdom,6
PENCIL CASE LIFE IS BEAUTIFUL,2.95,United Kingdom,6
PINK GLASS CANDLEHOLDER,2.95,United Kingdom,6
CUPID DESIGN SCENTED CANDLES,2.55,United Kingdom,6
WOODEN PICTURE FRAME WHITE FINISH,2.55,United Kingdom,6
WOOD S/3 CABINET ANT WHITE FINISH,7.95,United Kingdom,6
WHITE HANGING HEART T-LIGHT HOLDER,2.95,United Kingdom,6
CERAMIC CAKE BOWL + HANGING CAKES,2.95,United Kingdom,6
BATH BUILDING BLOCK WORD,6.6,United Kingdom,6
RECIPE BOX RETROSPOT ,2.95,United Kingdom,6
6 CHOCOLATE LOVE HEART T-LIGHTS,2.1,United Kingdom,6
RETROSPOT HEART HOT WATER BOTTLE,4.95,United Kingdom,6
SCOTTIE DOG HOT WATER BOTTLE,4.95,United Kingdom,6
SKULLS  DESIGN  COTTON TOTE BAG,2.25,United Kingdom,6
SAVE THE PLANET COTTON TOTE BAG,2.25,United Kingdom,6
BLUE 3 PIECE POLKADOT CUTLERY SET,3.75,United Kingdom,6
RED 3 PIECE RETROSPOT CUTLERY SET,3.75,United Kingdom,6
LUNCH BAG WOODLAND,1.65,United Kingdom,6
LUNCH BAG CARS BLUE,1.65,United Kingdom,6
BLUE ROSE PATCH PURSE PINK BUTTERFL,1.65,United Kingdom,6
RECORD FRAME 7" SINGLE SIZE ,2.55,France,6
LUNCH BOX WITH CUTLERY RETROSPOT ,2.55,France,6
STRAWBERRY LUNCH BOX WITH CUTLERY,2.55,France,6
RED RETROSPOT CHILDRENS UMBRELLA,3.25,France,6
PINK POLKADOT CHILDRENS UMBRELLA,3.25,France,6
METAL SIGN TAKE IT OR LEAVE IT ,2.95,France,6
SET OF 2 TEA TOWELS APPLE AND PEARS,2.95,France,6
FAWN BLUE HOT WATER BOTTLE,2.95,United Kingdom,6
FELTCRAFT DOLL MOLLY,2.95,United Kingdom,6
FELTCRAFT DOLL EMILY,2.95,United Kingdom,6
SILK PURSE BABUSHKA BLUE,3.35,United Kingdom,6
HEART OF WICKER LARGE,2.95,United Kingdom,6
RECIPE BOX RETROSPOT ,2.95,United Kingdom,6
FOOD CONTAINER SET 3 LOVE HEART ,1.95,United Kingdom,6
ROUND SNACK BOXES SET OF4 WOODLAND ,2.95,United Kingdom,6
ROUND SNACK BOXES SET OF 4 FRUITS ,2.95,United Kingdom,6
RETROSPOT HEART HOT WATER BOTTLE,4.95,United Kingdom,6
RETROSPOT HEART HOT WATER BOTTLE,4.95,France,6
FELTCRAFT DOLL MARIA,2.95,France,6
POPPY'S PLAYHOUSE BEDROOM ,2.1,France,6
POPPY'S PLAYHOUSE KITCHEN,2.1,France,6
POPPY'S PLAYHOUSE BATHROOM,2.1,France,6
ROSES REGENCY TEACUP AND SAUCER ,2.95,United Kingdom,6
POPPY'S PLAYHOUSE BEDROOM ,2.1,United Kingdom,6
ROTATING SILVER ANGELS T-LIGHT HLDR,2.55,United Kingdom,6
RED RETROSPOT CAKE STAND,10.95,United Kingdom,6
JAM MAKING SET WITH JARS,4.25,United Kingdom,6
RED HANGING HEART T-LIGHT HOLDER,2.95,United Kingdom,6
CANDLEHOLDER PINK HANGING HEART,2.95,United Kingdom,6
SET OF 6 T-LIGHTS SNOWMEN,2.95,United Kingdom,6
WHITE HANGING HEART T-LIGHT HOLDER,2.95,United Kingdom,6
REGENCY CAKESTAND 3 TIER,12.75,United Kingdom,6
TOADSTOOL MONEY BOX,2.95,Germany,6
CALENDAR PAPER CUT DESIGN,2.95,United Kingdom,6
WHITE TALL PORCELAIN T-LIGHT HOLDER,2.55,United Kingdom,6
CHOCOLATE HOT WATER BOTTLE,4.95,United Kingdom,6
SCOTTIE DOG HOT WATER BOTTLE,4.95,United Kingdom,6
ANTIQUE GLASS HEART DECORATION ,1.95,United Kingdom,6
HEART FILIGREE DOVE  SMALL,1.25,United Kingdom,6
WICKER STAR ,2.1,United Kingdom,6
CHILDS GARDEN SPADE PINK,2.1,United Kingdom,6
CHILDS GARDEN SPADE BLUE,2.1,United Kingdom,6
CHILDS GARDEN BRUSH BLUE,2.1,United Kingdom,6
RED RETROSPOT PEG BAG,2.1,United Kingdom,6
LARGE CAKE STAND  HANGING STRAWBERY,9.95,United Kingdom,6
CERAMIC CAKE STAND + HANGING CAKES,9.95,United Kingdom,6
CHILDS GARDEN BRUSH PINK,2.1,United Kingdom,6
HOME BUILDING BLOCK WORD,5.95,United Kingdom,6
6 CHOCOLATE LOVE HEART T-LIGHTS,2.1,United Kingdom,6
CANDLEHOLDER PINK HANGING HEART,2.95,United Kingdom,6
CARDHOLDER GINGHAM STAR,2.55,United Kingdom,6
RED WOOLLY HOTTIE WHITE HEART.,3.75,United Kingdom,6
PAPER CHAIN KIT 50'S CHRISTMAS ,2.95,United Kingdom,6
SET OF 3 HEART COOKIE CUTTERS,1.25,United Kingdom,6
SET OF 6 T-LIGHTS SNOWMEN,2.95,United Kingdom,6
SET OF 6 T-LIGHTS SANTA,2.95,United Kingdom,6
WHITE HANGING HEART T-LIGHT HOLDER,2.95,United Kingdom,6
FAWN BLUE HOT WATER BOTTLE,2.95,United Kingdom,6
WHITE SKULL HOT WATER BOTTLE ,3.75,United Kingdom,6
60 CAKE CASES VINTAGE CHRISTMAS,0.55,United Kingdom,6
FOLKART ZINC STAR CHRISTMAS DEC,0.85,United Kingdom,6
PAPER CHAIN KIT RETROSPOT,2.95,United Kingdom,6
RED HANGING HEART T-LIGHT HOLDER,2.95,United Kingdom,6
WHITE HANGING HEART T-LIGHT HOLDER,2.95,United Kingdom,6
HEART OF WICKER LARGE,2.95,United Kingdom,6
LADIES & GENTLEMEN METAL SIGN,2.55,United Kingdom,6
CHOCOLATE HOT WATER BOTTLE,4.95,United Kingdom,6
ANTIQUE ALL GLASS CANDLESTICK,2.1,United Kingdom,6
NO JUNK MAIL METAL SIGN,1.25,United Kingdom,6
PARTY METAL SIGN ,1.45,United Kingdom,6
PARTY CONE CHRISTMAS DECORATION ,0.85,United Kingdom,6
FRENCH PAISLEY CUSHION COVER ,2.95,United Kingdom,6
FOUR HOOK  WHITE LOVEBIRDS,2.1,Iceland,6
BOX OF 6 ASSORTED COLOUR TEASPOONS,4.25,Iceland,6
BLUE 3 PIECE POLKADOT CUTLERY SET,3.75,Iceland,6
RED 3 PIECE RETROSPOT CUTLERY SET,3.75,Iceland,6
PINK 3 PIECE POLKADOT CUTLERY SET,3.75,Iceland,6
BOOM BOX SPEAKER BOYS,5.95,Iceland,6
CAMOUFLAGE EAR MUFF HEADPHONES,5.49,Iceland,6
FELTCRAFT 6 FLOWER FRIENDS,2.1,United Kingdom,6
RED RETROSPOT CHILDRENS UMBRELLA,3.25,United Kingdom,6
CANDLEHOLDER PINK HANGING HEART,2.95,United Kingdom,6
FELTCRAFT 6 FLOWER FRIENDS,2.1,United Kingdom,6
SILVER PLATE CANDLE BOWL SMALL,2.95,United Kingdom,6
KITTY PENCIL ERASERS,0.43,United Kingdom,6
PINK CREAM FELT CRAFT TRINKET BOX ,2.51,United Kingdom,6
PACK OF 72 RETROSPOT CAKE CASES,1.28,United Kingdom,6
STRAWBERRY CERAMIC TRINKET BOX,2.51,United Kingdom,6
CAMOUFLAGE LED TORCH,3.36,United Kingdom,6
TRADITIONAL WOODEN CATCH CUP GAME ,2.51,United Kingdom,6
PACK OF 12 SUKI TISSUES ,0.85,United Kingdom,6
LARGE POPCORN HOLDER ,3.36,United Kingdom,6
MAGIC GARDEN FELT GARLAND ,4.21,United Kingdom,6
GREEN DRAWER KNOB ACRYLIC EDWARDIAN,2.51,United Kingdom,6
60 CAKE CASES VINTAGE CHRISTMAS,1.28,United Kingdom,6
CHARLIE+LOLA PINK HOT WATER BOTTLE,3.36,United Kingdom,6
SET OF 3 BUTTERFLY COOKIE CUTTERS,2.51,United Kingdom,6
WHITE TRAVEL ALARM CLOCK,2.51,United Kingdom,6
MULTI COLOUR SILVER T-LIGHT HOLDER,1.84,United Kingdom,6
ASSORTED COLOUR T-LIGHT HOLDER,0.99,United Kingdom,6
SKULLS WRITING SET ,3.36,United Kingdom,6
TOADSTOOL MONEY BOX,6.77,United Kingdom,6
BLUE SPOT CERAMIC DRAWER KNOB,3.36,United Kingdom,6
PACK OF 60 PINK PAISLEY CAKE CASES,2.13,United Kingdom,6
6 RIBBONS ELEGANT CHRISTMAS ,4.21,United Kingdom,6
FELTCRAFT BUTTERFLY HEARTS,4.21,United Kingdom,6
3 STRIPEY MICE FELTCRAFT,5.06,United Kingdom,6
CERAMIC STRAWBERRY CAKE MONEY BANK,4.21,United Kingdom,6
RED WOOLLY HOTTIE WHITE HEART.,8.47,United Kingdom,6
DOORMAT RED RETROSPOT,16.98,United Kingdom,6
LUNCH BAG  BLACK SKULL.,5.06,United Kingdom,6
LUNCH BAG CARS BLUE,5.06,United Kingdom,6
SET/6 RED SPOTTY PAPER CUPS,1.66,United Kingdom,6
RED WHITE SCARF  HOT WATER BOTTLE,8.47,United Kingdom,6
GRAND CHOCOLATECANDLE,2.82,United Kingdom,6
SUKI  SHOULDER BAG,4.21,United Kingdom,6
MULTI COLOUR SILVER T-LIGHT HOLDER,1.84,United Kingdom,6
LUNCH BAG RED RETROSPOT,5.06,United Kingdom,6
SET OF 6 FUNKY BEAKERS,2.95,United Kingdom,6
FAWN BLUE HOT WATER BOTTLE,2.95,United Kingdom,6
JAM MAKING SET WITH JARS,4.25,United Kingdom,6
OFFICE MUG WARMER POLKADOT,2.95,United Kingdom,6
OFFICE MUG WARMER CHOC+BLUE,2.95,United Kingdom,6
POLYESTER FILLER PAD 45x45cm,1.55,United Kingdom,6
APPLE BATH SPONGE,1.25,United Kingdom,6
WHITE HANGING HEART T-LIGHT HOLDER,2.95,United Kingdom,6
WHITE TALL PORCELAIN T-LIGHT HOLDER,2.55,United Kingdom,6
ROTATING SILVER ANGELS T-LIGHT HLDR,2.55,United Kingdom,6
IVORY KNITTED MUG COSY ,3.36,United Kingdom,6
HOT WATER BOTTLE I AM SO POORLY,9.32,United Kingdom,6
HOT WATER BOTTLE BABUSHKA ,9.32,United Kingdom,6
SET OF 20 VINTAGE CHRISTMAS NAPKINS,1.66,United Kingdom,6
COLOUR GLASS. STAR T-LIGHT HOLDER,6.77,United Kingdom,6
CHARLIE+LOLA PINK HOT WATER BOTTLE,3.36,United Kingdom,6
ROTATING SILVER ANGELS T-LIGHT HLDR,5.06,United Kingdom,6
MULTI COLOUR SILVER T-LIGHT HOLDER,1.84,United Kingdom,6
PACK OF 72 RETROSPOT CAKE CASES,1.28,United Kingdom,6
SMALL POPCORN HOLDER,1.66,United Kingdom,6
REGENCY CAKESTAND 3 TIER,12.75,United Kingdom,6
WHITE TALL PORCELAIN T-LIGHT HOLDER,2.55,United Kingdom,6
WOODEN FRAME ANTIQUE WHITE ,2.95,United Kingdom,6
RED RETROSPOT OVEN GLOVE DOUBLE,2.95,United Kingdom,6
MINT KITCHEN SCALES,8.5,Germany,6
RED HANGING HEART T-LIGHT HOLDER,2.95,United Kingdom,6
WHITE HANGING HEART T-LIGHT HOLDER,2.95,United Kingdom,6
SET OF 2 ROUND TINS CAMEMBERT ,2.95,Australia,6
RECIPE BOX RETROSPOT ,2.95,United Kingdom,6
CREAM SLICE FLANNEL PINK SPOT ,2.95,United Kingdom,6
CHILDREN'S APRON DOLLY GIRL ,2.1,United Kingdom,6
HAND OPEN SHAPE DECO.WHITE,3.49,United Kingdom,6
RED SPOTTY BISCUIT TIN,3.75,United Kingdom,6
SET/2 RED RETROSPOT TEA TOWELS ,2.95,United Kingdom,6
RED 3 PIECE RETROSPOT CUTLERY SET,3.75,United Kingdom,6
GREEN 3 PIECE POLKADOT CUTLERY SET,3.75,United Kingdom,6
BLUE 3 PIECE POLKADOT CUTLERY SET,3.75,United Kingdom,6
PINK 3 PIECE POLKADOT CUTLERY SET,3.75,United Kingdom,6
3D CHRISTMAS STAMPS STICKERS ,1.25,United Kingdom,6
PACK OF 6 BIRDY GIFT TAGS,1.25,United Kingdom,6
BUTTON BOX ,1.95,United Kingdom,6
6 RIBBONS RUSTIC CHARM,1.65,United Kingdom,6
RETROSPOT RED WASHING UP GLOVES,2.1,United Kingdom,6
20 DOLLY PEGS RETROSPOT,1.25,United Kingdom,6
SILVER PLATE CANDLE BOWL SMALL,2.95,United Kingdom,6
COFFEE MUG DOG + BALL DESIGN,2.55,United Kingdom,6
COFFEE MUG CAT + BIRD DESIGN,2.55,United Kingdom,6
SET OF 20 VINTAGE CHRISTMAS NAPKINS,0.85,United Kingdom,6
LADIES & GENTLEMEN METAL SIGN,2.55,United Kingdom,6
PORCELAIN BUTTERFLY OIL BURNER,2.95,United Kingdom,6
GUMBALL COAT RACK,2.55,United Kingdom,6
LADIES & GENTLEMEN METAL SIGN,2.55,United Kingdom,6
WOODEN FRAME ANTIQUE WHITE ,2.95,United Kingdom,6
HEART OF WICKER LARGE,2.95,United Kingdom,6
FELTCRAFT 6 FLOWER FRIENDS,2.1,United Kingdom,6
RECIPE BOX PANTRY YELLOW DESIGN,2.95,United Kingdom,6
RED HANGING HEART T-LIGHT HOLDER,2.95,United Kingdom,6
CERAMIC STRAWBERRY DESIGN MUG,1.49,United Kingdom,6
CHOC TRUFFLE GOLD TRINKET POT ,1.65,United Kingdom,6
CERAMIC CAKE DESIGN SPOTTED MUG,1.49,United Kingdom,6
POTTING SHED TEA MUG,1.25,United Kingdom,6
I CAN ONLY PLEASE ONE PERSON MUG,1.25,United Kingdom,6
PACK OF 60 PINK PAISLEY CAKE CASES,0.55,United Kingdom,6
72 SWEETHEART FAIRY CAKE CASES,0.55,United Kingdom,6
AREA PATROLLED METAL SIGN,2.1,United Kingdom,6
PAPER CHAIN KIT VINTAGE CHRISTMAS,2.95,France,6
PAPER CHAIN KIT 50'S CHRISTMAS ,2.95,France,6
MAKE YOUR OWN PLAYTIME CARD KIT,2.95,France,6
MAKE YOUR OWN MONSOON CARD KIT,2.95,France,6
SET OF 3 BUTTERFLY COOKIE CUTTERS,1.25,United Kingdom,6
 SET 2 TEA TOWELS I LOVE LONDON ,2.95,United Kingdom,6
GREEN REGENCY TEACUP AND SAUCER,2.95,United Kingdom,6
COFFEE MUG PINK PAISLEY DESIGN,2.55,United Kingdom,6
COFFEE MUG BLUE PAISLEY DESIGN,2.55,United Kingdom,6
VINTAGE UNION JACK BUNTING,8.5,United Kingdom,6
LOVE BUILDING BLOCK WORD,5.95,United Kingdom,6
FELTCRAFT 6 FLOWER FRIENDS,2.1,United Kingdom,6
3 STRIPEY MICE FELTCRAFT,1.95,United Kingdom,6
WOODEN PICTURE FRAME WHITE FINISH,2.55,United Kingdom,6
JAM MAKING SET WITH JARS,4.25,United Kingdom,6
FAWN BLUE HOT WATER BOTTLE,2.95,United Kingdom,6
COFFEE MUG CAT + BIRD DESIGN,2.55,United Kingdom,6
COFFEE MUG DOG + BALL DESIGN,2.55,United Kingdom,6
IVORY KNITTED MUG COSY ,1.65,United Kingdom,6
OFFICE MUG WARMER CHOC+BLUE,2.95,United Kingdom,6
3 STRIPEY MICE FELTCRAFT,1.95,United Kingdom,6
WHITE CHRYSANTHEMUMS ART FLOWER,2.1,United Kingdom,6
ASSORTED CHEESE FRIDGE MAGNETS,0.65,United Kingdom,6
PARTY CONE CHRISTMAS DECORATION ,0.85,United Kingdom,6
SCOTTIE DOG HOT WATER BOTTLE,4.95,United Kingdom,6
RED RETROSPOT BOWL,1.25,United Kingdom,6
RED RETROSPOT PLATE ,1.69,United Kingdom,6
JAM MAKING SET PRINTED,1.45,United Kingdom,6
JAM MAKING SET WITH JARS,4.25,United Kingdom,6
NATURAL SLATE HEART CHALKBOARD ,2.95,United Kingdom,6
SET 12 RETRO WHITE CHALK STICKS,0.42,United Kingdom,6
GLASS JAR KINGS CHOICE,2.95,United Kingdom,6
FLOWER VINE RAFFIA FOOD COVER,3.75,United Kingdom,6
GLITTER BUTTERFLY CLIPS,2.55,United Kingdom,6
3D DOG PICTURE PLAYING CARDS,2.95,United Kingdom,6
SET OF 6 FUNKY BEAKERS,2.95,United Kingdom,6
PAPER CHAIN KIT SKULLS ,2.95,United Kingdom,6
PAPER CHAIN KIT RETROSPOT,2.95,United Kingdom,6
PARTY PIZZA DISH RED RETROSPOT,0.85,United Kingdom,6
SMALL HAMMERED SILVER CANDLEPOT ,2.95,United Kingdom,6
SMALL HAMMERED SILVER CANDLEPOT ,2.95,United Kingdom,6
SMALL REGAL  SILVER CANDLEPOT ,2.95,United Kingdom,6
PAPER CHAIN KIT EMPIRE,2.95,United Kingdom,6
WHITE SPOT BLUE CERAMIC DRAWER KNOB,1.25,United Kingdom,6
BLUE SPOT CERAMIC DRAWER KNOB,1.25,United Kingdom,6
BLUE STRIPE CERAMIC DRAWER KNOB,1.25,United Kingdom,6
RED GINGHAM ROSE JEWELLERY BOX,1.65,United Kingdom,6
CINAMMON SET OF 9 T-LIGHTS,0.85,United Kingdom,6
RED TOADSTOOL LED NIGHT LIGHT,1.65,United Kingdom,6
RETROSPOT HEART HOT WATER BOTTLE,4.95,United Kingdom,6
GUMBALL COAT RACK,2.55,United Kingdom,6
WOODEN PICTURE FRAME WHITE FINISH,2.55,United Kingdom,6
WOODEN FRAME ANTIQUE WHITE ,2.95,United Kingdom,6
FIRST AID TIN,3.25,United Kingdom,6
OWL DOORSTOP,4.95,United Kingdom,6
DOORMAT FANCY FONT HOME SWEET HOME,7.95,United Kingdom,6
DOORMAT UNION FLAG,7.95,United Kingdom,6
KNITTED UNION FLAG HOT WATER BOTTLE,3.75,United Kingdom,6
SET/20 RED RETROSPOT PAPER NAPKINS ,0.85,United Kingdom,6
PACK OF 20 SPACEBOY NAPKINS,0.85,United Kingdom,6
WOODEN HEART CHRISTMAS SCANDINAVIAN,0.85,United Kingdom,6
COLUMBIAN CANDLE ROUND ,1.25,United Kingdom,6
COLUMBIAN CANDLE ROUND,0.65,United Kingdom,6
COLUMBIAN CUBE CANDLE,1.95,United Kingdom,6
COLUMBIAN CANDLE RECTANGLE,1.95,United Kingdom,6
MEASURING TAPE BABUSHKA PINK,2.95,United Kingdom,6
CERAMIC CAKE BOWL + HANGING CAKES,2.95,United Kingdom,6
PIGGY BANK RETROSPOT ,2.55,United Kingdom,6
LADIES & GENTLEMEN METAL SIGN,2.55,United Kingdom,6
COLUMBIAN CUBE CANDLE,1.95,United Kingdom,6
COLUMBIAN CANDLE RECTANGLE,1.95,United Kingdom,6
COLUMBIAN CANDLE ROUND,0.65,United Kingdom,6
WOODEN HEART CHRISTMAS SCANDINAVIAN,0.85,United Kingdom,6
WICKER STAR ,2.1,United Kingdom,6
HEART OF WICKER LARGE,2.95,United Kingdom,6
FAWN BLUE HOT WATER BOTTLE,2.95,United Kingdom,6
BAKING SET SPACEBOY DESIGN,4.95,United Kingdom,6
SILK PURSE BABUSHKA RED,3.35,United Kingdom,6
SILK PURSE BABUSHKA BLUE,3.35,United Kingdom,6
SILK PURSE BABUSHKA PINK,3.35,United Kingdom,6
COOKING SET RETROSPOT,9.95,Portugal,6
METAL SIGN TAKE IT OR LEAVE IT ,2.95,Portugal,6
NATURAL SLATE HEART CHALKBOARD ,2.95,Portugal,6
FAWN BLUE HOT WATER BOTTLE,2.95,Portugal,6
CREAM SLICE FLANNEL PINK SPOT ,2.95,Portugal,6
RED GINGHAM TEDDY BEAR ,2.95,Portugal,6
S/6 WOODEN SKITTLES IN COTTON BAG,2.95,Portugal,6
MAGAZINE RACK GEBRA ASSORTED ,2.75,Portugal,6
RED RETROSPOT SUGAR JAM BOWL,2.55,Portugal,6
RED RETROSPOT BUTTER DISH,4.95,Portugal,6
RED RETROSPOT MUG,2.95,Portugal,6
LUNCH BOX WITH CUTLERY RETROSPOT ,2.55,Portugal,6
CHILDREN'S APRON DOLLY GIRL ,2.1,Portugal,6
POSTAGE,28,Portugal,6
SET 10 LIGHTS NIGHT OWL,6.75,United Kingdom,6
RETROSPOT RED WASHING UP GLOVES,2.1,United Kingdom,6
SET/5 RED RETROSPOT LID GLASS BOWLS,2.95,United Kingdom,6
FOOD CONTAINER SET 3 LOVE HEART ,1.95,United Kingdom,6
RED 3 PIECE RETROSPOT CUTLERY SET,3.75,United Kingdom,6
GREEN 3 PIECE POLKADOT CUTLERY SET,3.75,United Kingdom,6
"SWISS ROLL TOWEL, PINK  SPOTS",2.95,United Kingdom,6
PAPER BUNTING RETROSPOT,2.95,United Kingdom,6
RED RETROSPOT SUGAR JAM BOWL,2.55,United Kingdom,6
SET/5 RED RETROSPOT LID GLASS BOWLS,2.95,United Kingdom,6
SET OF 20 VINTAGE CHRISTMAS NAPKINS,1.66,United Kingdom,6
CHARLIE+LOLA PINK HOT WATER BOTTLE,3.36,United Kingdom,6
MULTI COLOUR SILVER T-LIGHT HOLDER,1.84,United Kingdom,6
ANTIQUE ALL GLASS CANDLESTICK,2.51,United Kingdom,6
PACK OF 12 SUKI TISSUES ,0.85,United Kingdom,6
VINTAGE PAISLEY STATIONERY SET,2.51,United Kingdom,6
FULL ENGLISH BREAKFAST PLATE,7.62,United Kingdom,6
VICTORIAN GLASS HANGING T-LIGHT,2.51,United Kingdom,6
LOVEBIRD HANGING DECORATION WHITE ,1.66,United Kingdom,6
6 RIBBONS RUSTIC CHARM,1.65,United Kingdom,7
TOTE BAG I LOVE LONDON,2.1,United Kingdom,7
TOTE BAG I LOVE LONDON,2.1,United Kingdom,7
 SET 2 TEA TOWELS I LOVE LONDON ,2.95,United Kingdom,7
4 TRADITIONAL SPINNING TOPS,2.51,United Kingdom,7
JAM MAKING SET WITH JARS,8.47,United Kingdom,7
SET/10 RED POLKADOT PARTY CANDLES,2.51,United Kingdom,7
SCOTTIE DOG HOT WATER BOTTLE,4.95,United Kingdom,7
EUCALYPTUS & PINECONE  WREATH,5.91,United Kingdom,7
PINK HEART DOTS HOT WATER BOTTLE,4.21,United Kingdom,7
POLKADOT RAIN HAT ,0.85,United Kingdom,7
6 RIBBONS RUSTIC CHARM,3.36,United Kingdom,7
HEART DECORATION RUSTIC HANGING ,0.81,United Kingdom,7
LIPSTICK PEN RED,0.85,United Kingdom,7
RIBBON REEL CHRISTMAS SOCK BAUBLE,3.36,United Kingdom,7
HAND WARMER OWL DESIGN,4.21,United Kingdom,7
SET OF 20 VINTAGE CHRISTMAS NAPKINS,1.66,United Kingdom,7
60 CAKE CASES VINTAGE CHRISTMAS,1.28,United Kingdom,7
SOLDIERS EGG CUP ,2.51,United Kingdom,7
PINK 3 PIECE POLKADOT CUTLERY SET,3.75,United Kingdom,7
6 CHOCOLATE LOVE HEART T-LIGHTS,2.1,United Kingdom,7
GENTLEMAN SHIRT REPAIR KIT ,0.85,United Kingdom,7
CHOCOLATE HOT WATER BOTTLE,4.95,United Kingdom,7
CHRISTMAS CRAFT LITTLE FRIENDS,4.21,United Kingdom,7
PORCELAIN BUTTERFLY OIL BURNER,5.06,United Kingdom,7
WASH BAG VINTAGE ROSE PAISLEY,5.91,United Kingdom,7
IVORY KNITTED MUG COSY ,3.36,United Kingdom,7
LIPSTICK PEN RED,0.85,United Kingdom,7
ROCKING HORSE RED CHRISTMAS ,1.66,United Kingdom,7
GREEN REGENCY TEACUP AND SAUCER,5.91,United Kingdom,7
SET OF 3 NOTEBOOKS IN PARCEL,3.36,United Kingdom,7
SET OF 2 CHRISTMAS DECOUPAGE CANDLE,1.66,United Kingdom,7
STRAWBERRY CERAMIC TRINKET BOX,2.51,United Kingdom,7
WHITE GOOSE FEATHER CHRISTMAS TREE ,7.62,United Kingdom,7
SUKI  SHOULDER BAG,1.65,United Kingdom,7
WHITE HANGING HEART T-LIGHT HOLDER,2.95,United Kingdom,7
60 CAKE CASES VINTAGE CHRISTMAS,0.55,United Kingdom,7
SET/20 RED RETROSPOT PAPER NAPKINS ,0.85,United Kingdom,7
BALLOONS  WRITING SET ,3.36,United Kingdom,7
RETROSPOT HEART HOT WATER BOTTLE,11.02,United Kingdom,7
10 COLOUR SPACEBOY PEN,2.51,United Kingdom,7
RIBBON REEL CHRISTMAS SOCK BAUBLE,4.21,United Kingdom,7
SET OF 3 BABUSHKA STACKING TINS,4.95,United Kingdom,7
FINE WICKER HEART ,1.25,United Kingdom,7
WICKER STAR ,2.1,United Kingdom,7
ROCKING HORSE RED CHRISTMAS ,0.85,United Kingdom,7
36 FOIL STAR CAKE CASES ,2.1,United Kingdom,7
HAND WARMER BABUSHKA DESIGN,2.1,United Kingdom,7
HAND WARMER RED RETROSPOT,2.1,United Kingdom,7
HAND WARMER OWL DESIGN,2.1,United Kingdom,7
HAND WARMER UNION JACK,2.1,United Kingdom,7
VINTAGE SNAP CARDS,0.85,United Kingdom,7
HEART FILIGREE DOVE  SMALL,1.25,United Kingdom,7
CHRISTMAS RETROSPOT STAR WOOD,0.85,United Kingdom,7
WOODEN TREE CHRISTMAS SCANDINAVIAN,0.85,United Kingdom,7
12 PENCILS SMALL TUBE RED RETROSPOT,1.28,United Kingdom,7
SWISS CHALET TREE DECORATION ,1.28,United Kingdom,7
ROCKING HORSE RED CHRISTMAS ,1.66,United Kingdom,7
HEART WOODEN CHRISTMAS DECORATION,1.66,United Kingdom,7
CHRISTMAS GINGHAM HEART,1.66,United Kingdom,7
ROSES REGENCY TEACUP AND SAUCER ,5.91,United Kingdom,7
SET OF 3 NOTEBOOKS IN PARCEL,3.36,United Kingdom,7
HAND WARMER BIRD DESIGN,4.21,United Kingdom,7
FOLKART ZINC HEART CHRISTMAS DEC,1.66,United Kingdom,7
BEADED CRYSTAL HEART GREEN ON STICK,0.85,United Kingdom,7
WICKER STAR ,4.21,United Kingdom,7
CHRISTMAS PUDDING TRINKET POT ,3.36,United Kingdom,7
CHOCOLATE HOT WATER BOTTLE,11.02,United Kingdom,7
HEART GARLAND RUSTIC PADDED,3.36,United Kingdom,7
BEADED CRYSTAL HEART BLUE ON STICK,0.85,United Kingdom,7
HANGING WOOD AND FELT HEART,0.84,United Kingdom,7
HAND WARMER BABUSHKA DESIGN,2.1,United Kingdom,7
HAND WARMER SCOTTY DOG DESIGN,2.1,United Kingdom,7
PINK  POLKADOT CUP,0.85,United Kingdom,7
LARGE HANGING IVORY & RED WOOD BIRD,0.65,United Kingdom,7
12 PENCILS SMALL TUBE RED RETROSPOT,1.28,United Kingdom,7
ANTIQUE ALL GLASS CANDLESTICK,2.51,United Kingdom,7
VINTAGE SNAP CARDS,1.66,United Kingdom,7
VINTAGE PAISLEY STATIONERY SET,2.51,United Kingdom,7
TEA BAG PLATE RED RETROSPOT,1.66,United Kingdom,7
LIPSTICK PEN FUSCHIA,0.85,United Kingdom,7
HEART WOODEN CHRISTMAS DECORATION,1.66,United Kingdom,7
CHRISTMAS GINGHAM STAR,1.66,United Kingdom,7
FUNKY DIVA PEN,1.66,United Kingdom,7
HOT WATER BOTTLE I AM SO POORLY,9.32,United Kingdom,7
PAPER CHAIN KIT VINTAGE CHRISTMAS,5.91,United Kingdom,7
SMALLFOLKART BAUBLE CHRISTMAS DEC,1.66,United Kingdom,7
MINI JIGSAW SPACEBOY,0.42,United Kingdom,7
ASSORTED COLOUR BIRD ORNAMENT,1.69,United Kingdom,7
RED FLOWER CROCHET FOOD COVER,3.75,United Kingdom,7
HAND WARMER RED RETROSPOT,2.1,United Kingdom,7
METAL DECORATION NAUGHTY CHILDREN ,0.85,United Kingdom,7
ANTIQUE TALL SWIRLGLASS TRINKET POT,3.75,United Kingdom,7
SMALL GLASS HEART TRINKET POT,4.21,United Kingdom,7
PINK DIAMANTE PEN IN GIFT BOX,4.21,United Kingdom,7
HEART DECORATION RUSTIC HANGING ,0.81,United Kingdom,7
SCOTTIES CHILDRENS APRON,1.66,United Kingdom,7
KNITTED UNION FLAG HOT WATER BOTTLE,7.62,United Kingdom,7
ROTATING SILVER ANGELS T-LIGHT HLDR,5.06,United Kingdom,7
SET OF 20 KIDS COOKIE CUTTERS,4.21,United Kingdom,7
DINOSAURS  WRITING SET ,3.36,United Kingdom,7
PIGGY BANK RETROSPOT ,5.91,United Kingdom,7
RIBBON REEL CHRISTMAS PRESENT ,4.21,United Kingdom,7
DOORMAT BLACK FLOCK ,16.98,United Kingdom,7
