Description,UnitPrice,Country,Quantity
BROWN CHECK CAT DOORSTOP ,4.25,United Kingdom,1
HAND TOWEL PALE BLUE W FLOWERS,5.95,United Kingdom,1
BLUE ORGANDY ROUND LAMPSHADE W BEA,0.85,United Kingdom,1
TEA TIME DES TEA COSY,2.55,United Kingdom,1
WHITE AND BLUE CERAMIC OIL BURNER,1.25,United Kingdom,1
NATURAL SLATE CHALKBOARD LARGE ,4.95,United Kingdom,1
AIRLINE BAG VINTAGE TOKYO 78,4.25,United Kingdom,1
RECIPE BOX BLUE SKETCHBOOK DESIGN,2.95,United Kingdom,1
RECIPE BOX PANTRY YELLOW DESIGN,2.95,United Kingdom,1
AIRLINE BAG VINTAGE TOKYO 78,4.25,United Kingdom,1
ENGLISH ROSE HOT WATER BOTTLE,4.25,United Kingdom,1
CHOCOLATE HOT WATER BOTTLE,4.95,United Kingdom,1
SCOTTIE DOG HOT WATER BOTTLE,4.95,United Kingdom,1
RETROSPOT HEART HOT WATER BOTTLE,4.95,United Kingdom,1
12 PENCILS TALL TUBE RED RETROSPOT,0.85,United Kingdom,1
CHARLIE AND LOLA CHARLOTTE BAG,1.65,United Kingdom,1
KNITTED UNION FLAG HOT WATER BOTTLE,3.75,United Kingdom,1
HOT WATER BOTTLE TEA AND SYMPATHY,3.95,United Kingdom,1
PAPER CHAIN KIT 50'S CHRISTMAS ,2.95,United Kingdom,1
CANDLEHOLDER PINK HANGING HEART,2.95,United Kingdom,1
SKULL LUNCH BOX WITH CUTLERY ,2.55,United Kingdom,1
60 CAKE CASES VINTAGE CHRISTMAS,0.55,United Kingdom,1
60 CAKE CASES VINTAGE CHRISTMAS,0.55,United Kingdom,1
12 PENCIL SMALL TUBE WOODLAND,0.65,United Kingdom,1
36 PENCILS TUBE RED RETROSPOT,1.25,United Kingdom,1
12 PENCILS TALL TUBE WOODLAND,0.85,United Kingdom,1
NO SINGING METAL SIGN,2.1,United Kingdom,1
HAND WARMER RED RETROSPOT,2.1,United Kingdom,1
YOU'RE CONFUSING ME METAL SIGN ,1.69,United Kingdom,1
WASHROOM METAL SIGN,1.45,United Kingdom,1
LAUNDRY 15C METAL SIGN,1.45,United Kingdom,1
HOUSE WRECKING METAL SIGN ,2.1,United Kingdom,1
PLEASE ONE PERSON METAL SIGN,2.1,United Kingdom,1
MAN FLU METAL SIGN,2.1,United Kingdom,1
PAPER CHAIN KIT LONDON,2.95,United Kingdom,1
PAPER CHAIN KIT SKULLS ,2.95,United Kingdom,1
LUNCH BOX I LOVE LONDON,1.95,United Kingdom,1
POTTERING MUG,1.25,United Kingdom,1
HAND WARMER SCOTTY DOG DESIGN,2.1,United Kingdom,1
HAND WARMER RED RETROSPOT,2.1,United Kingdom,1
HAND WARMER OWL DESIGN,2.1,United Kingdom,1
DOLLY GIRL LUNCH BOX,1.95,United Kingdom,1
LUNCH BOX I LOVE LONDON,1.95,United Kingdom,1
WAKE UP COCKEREL CALENDAR SIGN ,3.75,United Kingdom,1
ALARM CLOCK BAKELIKE GREEN,3.75,United Kingdom,1
ALARM CLOCK BAKELIKE PINK,3.75,United Kingdom,1
ALARM CLOCK BAKELIKE IVORY,3.75,United Kingdom,1
Manual,35,United Kingdom,1
GARDEN PATH JOURNAL,2.55,United Kingdom,1
CHRISTMAS LIGHTS 10 REINDEER,8.5,United Kingdom,1
CHRISTMAS LIGHTS 10 SANTAS ,8.5,United Kingdom,1
WHITE TISSUE REAM,7.95,United Kingdom,1
TRADITIONAL CHRISTMAS RIBBONS,1.25,United Kingdom,1
6 RIBBONS ELEGANT CHRISTMAS ,1.65,United Kingdom,1
GREEN REGENCY TEACUP AND SAUCER,2.95,United Kingdom,1
ROSES REGENCY TEACUP AND SAUCER ,2.95,United Kingdom,1
BOX OF VINTAGE ALPHABET BLOCKS,9.95,United Kingdom,1
BOX OF VINTAGE JIGSAW BLOCKS ,4.95,United Kingdom,1
COOK WITH WINE METAL SIGN ,1.95,United Kingdom,1
"STRING OF 8 BUTTERFLIES,PINK",1.65,United Kingdom,1
GLITTER HANGING BUTTERFLY STRING,2.1,United Kingdom,1
SET OF 3 BIRD LIGHT PINK FEATHER ,1.25,United Kingdom,1
CHARLIE+LOLA RED HOT WATER BOTTLE ,4.65,United Kingdom,1
CHARLIE LOLA BLUE HOT WATER BOTTLE ,4.65,United Kingdom,1
CHRISTMAS CRAFT TREE TOP ANGEL,2.1,United Kingdom,1
BROWN CHECK CAT DOORSTOP ,4.25,United Kingdom,1
ENAMEL WATERING CAN CREAM,4.95,United Kingdom,1
EMERGENCY FIRST AID TIN ,1.25,United Kingdom,1
JUMBO BAG SCANDINAVIAN PAISLEY,1.95,United Kingdom,1
JUMBO STORAGE BAG SUKI,1.95,United Kingdom,1
CHILDS BREAKFAST SET DOLLY GIRL ,9.95,United Kingdom,1
MEMO BOARD RETROSPOT  DESIGN,4.95,United Kingdom,1
CHARLIE & LOLA WASTEPAPER BIN FLORA,3.75,United Kingdom,1
VINTAGE CREAM CAT FOOD CONTAINER,6.35,United Kingdom,1
AIRLINE BAG VINTAGE JET SET BROWN,4.25,United Kingdom,1
AIRLINE BAG VINTAGE WORLD CHAMPION ,4.25,United Kingdom,1
VINTAGE UNION JACK BUNTING,8.5,United Kingdom,1
CHILDRENS GARDEN GLOVES BLUE,1.25,United Kingdom,1
AIRLINE BAG VINTAGE JET SET RED,4.25,United Kingdom,1
SHOE SHINE BOX ,9.95,United Kingdom,1
RED RETROSPOT LUGGAGE TAG,1.25,United Kingdom,1
3 PIECE SPACEBOY COOKIE CUTTER SET,2.1,United Kingdom,1
SET OF 3 HEART COOKIE CUTTERS,1.25,United Kingdom,1
3 TRADITIONAl BISCUIT CUTTERS  SET,2.1,United Kingdom,1
RED KITCHEN SCALES,8.5,United Kingdom,1
SWEETHEART RECIPE BOOK STAND,6.75,United Kingdom,1
PLEASE ONE PERSON METAL SIGN,2.1,United Kingdom,1
HOT BATHS METAL SIGN,2.1,United Kingdom,1
RED HANGING HEART T-LIGHT HOLDER,2.95,United Kingdom,1
36 FOIL HEART CAKE CASES,2.1,United Kingdom,1
LAUNDRY 15C METAL SIGN,1.45,United Kingdom,1
WASHROOM METAL SIGN,1.45,United Kingdom,1
SET 7 BABUSHKA NESTING BOXES,8.5,United Kingdom,1
REGENCY CAKESTAND 3 TIER,12.75,United Kingdom,1
SILK PURSE BABUSHKA PINK,3.35,United Kingdom,1
SILK PURSE BABUSHKA RED,3.35,United Kingdom,1
SILK PURSE BABUSHKA BLUE,3.35,United Kingdom,1
SMALL HEART MEASURING SPOONS,0.85,United Kingdom,1
UNION JACK FLAG PASSPORT COVER ,2.1,United Kingdom,1
PLASTERS IN TIN SPACEBOY,1.65,United Kingdom,1
UNION JACK FLAG LUGGAGE TAG,1.25,United Kingdom,1
DOORMAT UNION JACK GUNS AND ROSES,7.95,United Kingdom,1
GOLD WASHBAG,2.95,United Kingdom,1
BREAD BIN DINER STYLE PINK,16.95,United Kingdom,1
PINK UNION JACK  LUGGAGE TAG,1.25,United Kingdom,1
PINK UNION JACK  PASSPORT COVER ,2.1,United Kingdom,1
PLASTERS IN TIN VINTAGE PAISLEY ,1.65,United Kingdom,1
HAND WARMER SCOTTY DOG DESIGN,2.1,United Kingdom,1
LARGE HEART MEASURING SPOONS,1.65,United Kingdom,1
PLASTERS IN TIN STRONGMAN,1.65,United Kingdom,1
PLASTERS IN TIN SPACEBOY,1.65,United Kingdom,1
PLASTERS IN TIN CIRCUS PARADE ,1.65,United Kingdom,1
BLACK/BLUE POLKADOT UMBRELLA,5.95,United Kingdom,1
PURPLE PAPER PARASOL,2.95,United Kingdom,1
BLUE PAPER PARASOL ,2.95,United Kingdom,1
LOVE LARGE WOOD LETTERS ,12.75,United Kingdom,1
"ART LIGHTS,FUNK MONKEY",2.95,United Kingdom,1
HOT WATER BOTTLE I AM SO POORLY,4.65,United Kingdom,1
JUMBO BAG OWLS,1.95,United Kingdom,1
JUMBO BAG SPACEBOY DESIGN,1.95,United Kingdom,1
JUMBO STORAGE BAG SKULLS,1.95,United Kingdom,1
KEY CABINET MA CAMPAGNE,9.95,United Kingdom,1
SMALL PURPLE BABUSHKA NOTEBOOK ,0.85,United Kingdom,1
RIBBON REEL CHRISTMAS SOCK BAUBLE,1.65,United Kingdom,1
WHITE SKULL HOT WATER BOTTLE ,3.75,United Kingdom,1
HOT WATER BOTTLE TEA AND SYMPATHY,3.95,United Kingdom,1
RED RETROSPOT ROUND CAKE TINS,9.95,United Kingdom,1
CHICK GREY HOT WATER BOTTLE,3.45,United Kingdom,1
ADVENT CALENDAR GINGHAM SACK,5.95,United Kingdom,1
SET OF 3 BLACK FLYING DUCKS,5.45,United Kingdom,1
PAPER BUNTING WHITE LACE,2.95,United Kingdom,1
RECORD FRAME 7" SINGLE SIZE ,2.55,United Kingdom,1
FRENCH GARDEN SIGN BLUE METAL,1.25,United Kingdom,1
GREEN CHRISTMAS TREE STRING 20LIGHT,4.95,United Kingdom,1
3 TIER CAKE TIN GREEN AND CREAM,14.95,United Kingdom,1
SILVER CHRISTMAS TREE BAUBLE STAND ,16.95,United Kingdom,1
CALENDAR PAPER CUT DESIGN,2.95,United Kingdom,1
VINTAGE UNION JACK MEMOBOARD,9.95,United Kingdom,1
PINK CREAM FELT CRAFT TRINKET BOX ,1.25,United Kingdom,1
SHOE SHINE BOX ,9.95,United Kingdom,1
PHOTO CUBE,1.65,United Kingdom,1
HOT WATER BOTTLE BABUSHKA ,4.65,United Kingdom,1
HAND WARMER UNION JACK,2.1,United Kingdom,1
60 CAKE CASES VINTAGE CHRISTMAS,0.55,United Kingdom,1
CHILDS BREAKFAST SET DOLLY GIRL ,9.95,United Kingdom,1
SILVER TEDDY BEAR,3.75,United Kingdom,1
PINK/WHITE CHRISTMAS TREE 60CM,1.25,United Kingdom,1
CHRISTMAS LIGHTS 10 REINDEER,8.5,United Kingdom,1
 SET 2 TEA TOWELS I LOVE LONDON ,2.95,United Kingdom,1
SET 12 KIDS COLOUR  CHALK STICKS,0.42,United Kingdom,1
WOODEN BOX OF DOMINOES,1.25,United Kingdom,1
PAPER CHAIN KIT VINTAGE CHRISTMAS,2.95,United Kingdom,1
RABBIT  DESIGN  COTTON TOTE BAG,2.25,United Kingdom,1
WOODLAND DESIGN  COTTON TOTE BAG,2.25,United Kingdom,1
SMALL PURPLE BABUSHKA NOTEBOOK ,0.85,United Kingdom,1
HAND WARMER UNION JACK,2.1,United Kingdom,1
CHRISTMAS CRAFT TREE TOP ANGEL,2.1,United Kingdom,1
PSYCHEDELIC WALL THERMOMETER,2.55,United Kingdom,1
ALARM CLOCK BAKELIKE GREEN,3.75,United Kingdom,1
ALARM CLOCK BAKELIKE RED ,3.75,United Kingdom,1
ALARM CLOCK BAKELIKE PINK,3.75,United Kingdom,1
RED WOOLLY HOTTIE WHITE HEART.,3.75,United Kingdom,1
HAND WARMER OWL DESIGN,2.1,United Kingdom,1
PAPER CHAIN KIT 50'S CHRISTMAS ,2.95,United Kingdom,1
HAND WARMER UNION JACK,2.1,United Kingdom,1
BLUE GIANT GARDEN THERMOMETER,5.95,United Kingdom,1
HAND WARMER SCOTTY DOG DESIGN,2.1,United Kingdom,1
BINGO SET,3.75,United Kingdom,1
FELTCRAFT CUSHION RABBIT,3.75,United Kingdom,1
PACK OF 6 BIRDY GIFT TAGS,1.25,United Kingdom,1
TRADITIONAL CHRISTMAS RIBBONS,1.25,United Kingdom,1
FELTCRAFT CUSHION OWL,3.75,United Kingdom,1
PACK OF 6 BIRDY GIFT TAGS,1.25,United Kingdom,1
ROCKING HORSE GREEN CHRISTMAS ,0.85,United Kingdom,1
ALARM CLOCK BAKELIKE PINK,3.75,United Kingdom,1
ALARM CLOCK BAKELIKE ORANGE,3.75,United Kingdom,1
GREEN CHRISTMAS TREE CARD HOLDER,4.25,United Kingdom,1
REGENCY CAKESTAND 3 TIER,12.75,United Kingdom,1
FELTCRAFT CUSHION OWL,3.75,United Kingdom,1
SCOTTIE DOG HOT WATER BOTTLE,4.95,United Kingdom,1
3 STRIPEY MICE FELTCRAFT,1.95,United Kingdom,1
ENGLISH ROSE HOT WATER BOTTLE,4.25,United Kingdom,1
SET/20 RED RETROSPOT PAPER NAPKINS ,0.85,United Kingdom,1
SMALL GLASS HEART TRINKET POT,2.1,United Kingdom,1
VANILLA SCENT CANDLE JEWELLED BOX,4.25,United Kingdom,1
VANILLA SCENT CANDLE JEWELLED BOX,4.25,United Kingdom,1
CREAM CUPID HEARTS COAT HANGER,3.25,United Kingdom,1
NATURAL SLATE RECTANGLE CHALKBOARD,1.65,United Kingdom,1
GREY HEART HOT WATER BOTTLE,3.75,United Kingdom,1
VINTAGE CREAM CAT FOOD CONTAINER,6.35,United Kingdom,1
SET OF 20 VINTAGE CHRISTMAS NAPKINS,0.85,United Kingdom,1
PACK 20 ENGLISH ROSE PAPER NAPKINS,0.85,United Kingdom,1
SET/20 STRAWBERRY PAPER NAPKINS ,0.85,United Kingdom,1
RIBBON REEL MAKING SNOWMEN ,1.65,United Kingdom,1
RIBBON REEL CHRISTMAS PRESENT ,1.65,United Kingdom,1
ROSE 1 WICK MORRIS BOXED CANDLE,4.25,United Kingdom,1
VINTAGE UNION JACK MEMOBOARD,9.95,United Kingdom,1
DOORMAT HOME SWEET HOME BLUE ,7.95,United Kingdom,1
DOORMAT I LOVE LONDON,7.95,United Kingdom,1
REX CASH+CARRY JUMBO SHOPPER,0.95,United Kingdom,1
SET OF 6 3D KIT CARDS FOR KIDS,0.85,United Kingdom,1
MAGIC DRAWING SLATE PURDEY,0.42,United Kingdom,1
MAGIC DRAWING SLATE LEAP FROG ,0.42,United Kingdom,1
DOORMAT RED RETROSPOT,14.43,United Kingdom,1
MOUSEY LONG LEGS SOFT TOY,5.06,United Kingdom,1
JUMBO BAG OWLS,4.21,United Kingdom,1
LUNCH BAG CARS BLUE,4.21,United Kingdom,1
BLACK MINI TAPE MEASURE ,0.85,United Kingdom,1
BLUE POLKADOT WASHING UP GLOVES,4.21,United Kingdom,1
RETROSPOT RED WASHING UP GLOVES,4.21,United Kingdom,1
ABSTRACT CIRCLE JOURNAL ,2.51,United Kingdom,1
STRAWBERRY BATH SPONGE ,2.51,United Kingdom,1
APPLE BATH SPONGE,2.51,United Kingdom,1
ROSE DU SUD COSMETICS BAG,3.36,United Kingdom,1
ROSE DU SUD DRAWSTRING BAG,3.36,United Kingdom,1
SPACE OWL,2.51,United Kingdom,1
NINJA RABBIT BLACK,2.51,United Kingdom,1
SET/2 RED RETROSPOT TEA TOWELS ,5.91,United Kingdom,1
VINTAGE BILLBOARD TEA MUG,2.51,United Kingdom,1
SET/20 RED RETROSPOT PAPER NAPKINS ,1.66,United Kingdom,1
CREAM SLICE FLANNEL PINK SPOT ,5.91,United Kingdom,1
"LARGE CAKE TOWEL, CHOCOLATE SPOTS",13.57,United Kingdom,1
"SWISS ROLL TOWEL, CHOCOLATE  SPOTS",5.91,United Kingdom,1
SET/10 BLUE POLKADOT PARTY CANDLES,2.51,United Kingdom,1
ANTIQUE GLASS HEART DECORATION ,4.21,United Kingdom,1
JINGLE BELLS TREE DECORATION,2.51,United Kingdom,1
RED RETROSPOT PEG BAG,4.21,United Kingdom,1
TOXIC AREA  DOOR HANGER ,3.36,United Kingdom,1
DO NOT TOUCH MY STUFF DOOR HANGER ,3.36,United Kingdom,1
BATHROOM METAL SIGN ,3.36,United Kingdom,1
POTTERING IN THE SHED METAL SIGN,4.21,United Kingdom,1
WHITE HONEYCOMB PAPER GARLAND ,3.36,United Kingdom,1
DAISIES  HONEYCOMB GARLAND ,3.36,United Kingdom,1
SET OF 72 RETROSPOT PAPER  DOILIES,2.98,United Kingdom,1
RED RETROSPOT ROUND CAKE TINS,21.23,United Kingdom,1
SET/4 BADGES BEETLES,2.51,United Kingdom,1
PINK  POLKADOT CUP,1.66,United Kingdom,1
DINOSAUR HEIGHT CHART STICKER SET,5.91,United Kingdom,1
SET OF PICTURE FRAME  STICKERS,5.91,United Kingdom,1
WHITE GOOSE FEATHER CHRISTMAS TREE ,7.62,United Kingdom,1
GREEN GOOSE FEATHER TREE 60CM,5.91,United Kingdom,1
SALLE DE BAIN HOOK,2.51,United Kingdom,1
SMALL POLKADOT CHOCOLATE GIFT BAG ,1.66,United Kingdom,1
GLASS HEART T-LIGHT HOLDER ,1.66,United Kingdom,1
SKULLS WRITING SET ,3.36,United Kingdom,1
CLASSIC METAL BIRDCAGE PLANT HOLDER,25.49,United Kingdom,1
LOVE LARGE WOOD LETTERS ,25.49,United Kingdom,1
HOME SMALL WOOD LETTERS,11.02,United Kingdom,1
MIRRORED WALL ART GENTS,5.06,United Kingdom,1
BLUE PUDDING SPOON,0.85,United Kingdom,1
BASKET OF TOADSTOOLS,2.51,United Kingdom,1
12 DAISY PEGS IN WOOD BOX,3.36,United Kingdom,1
FLOWER VINE RAFFIA FOOD COVER,7.62,United Kingdom,1
CHICK GREY HOT WATER BOTTLE,7.62,United Kingdom,1
ROTATING LEAVES T-LIGHT HOLDER,5.06,United Kingdom,1
"FANCY FONT BIRTHDAY CARD, ",0.85,United Kingdom,1
VINTAGE KID DOLLY CARD ,0.85,United Kingdom,1
DOORMAT SPOTTY HOME SWEET HOME,14.43,United Kingdom,1
SKULL LUNCH BOX WITH CUTLERY ,5.06,United Kingdom,1
STRAWBERRY LUNCH BOX WITH CUTLERY,5.06,United Kingdom,1
SAVE THE PLANET COTTON TOTE BAG,5.06,United Kingdom,1
SKULLS  DESIGN  COTTON TOTE BAG,5.06,United Kingdom,1
Dad's Cab Electronic Meter,8.47,United Kingdom,1
MEDIUM MEDINA STAMPED METAL BOWL ,5.91,United Kingdom,1
MOCK LOBSTER FRIDGE MAGNET,1.66,United Kingdom,1
GIRLS VINTAGE TIN SEASIDE BUCKET,5.06,United Kingdom,1
ALPHABET HEARTS STICKER SHEET,1.66,United Kingdom,1
PANDA AND BUNNIES STICKER SHEET,1.66,United Kingdom,1
GLASS STAR FROSTED T-LIGHT HOLDER,10.17,United Kingdom,1
RED HANGING HEART T-LIGHT HOLDER,5.91,United Kingdom,1
LOVE BUILDING BLOCK WORD,11.87,United Kingdom,1
BATH BUILDING BLOCK WORD,11.87,United Kingdom,1
DECORATIVE ROSE BATHROOM BOTTLE,2.51,United Kingdom,1
DECORATIVE FLORE BATHROOM BOTTLE,2.51,United Kingdom,1
VINTAGE HEADS AND TAILS CARD GAME ,2.51,United Kingdom,1
CHRISTMAS HANGING STAR WITH BELL,2.51,United Kingdom,1
GARLAND WITH STARS AND BELLS,10.17,United Kingdom,1
STAR  T-LIGHT HOLDER ,2.98,United Kingdom,1
PINK DIAMANTE PEN IN GIFT BOX,4.21,United Kingdom,1
UNION JACK FLAG LUGGAGE TAG,2.51,United Kingdom,1
I CAN ONLY PLEASE ONE PERSON MUG,3.36,United Kingdom,1
POTTERING MUG,3.36,United Kingdom,1
"KEY FOB , GARAGE DESIGN",1.66,United Kingdom,1
MAN FLU METAL SIGN,4.21,United Kingdom,1
PHARMACIE FIRST AID TIN,13.57,United Kingdom,1
I'M ON HOLIDAY METAL SIGN,4.21,United Kingdom,1
SCANDINAVIAN PAISLEY PICNIC BAG,5.91,United Kingdom,1
PINK VINTAGE PAISLEY PICNIC BAG,5.91,United Kingdom,1
STRAWBERRY   PICNIC BAG,5.91,United Kingdom,1
SKULLS DESIGN FLANNEL,1.66,United Kingdom,1
KITTENS DESIGN FLANNEL,1.66,United Kingdom,1
STRAWBERRIES  DESIGN FLANNEL ,1.66,United Kingdom,1
SET OF 6 CAKE CHOPSTICKS,2.51,United Kingdom,1
PACK OF 60 MUSHROOM CAKE CASES,1.28,United Kingdom,1
PACK OF 12 RED RETROSPOT TISSUES ,0.85,United Kingdom,1
PACK OF 12 BLUE PAISLEY TISSUES ,0.85,United Kingdom,1
EMPIRE BIRTHDAY CARD,0.85,United Kingdom,1
RAINY LADIES BIRTHDAY CARD,0.85,United Kingdom,1
PENNY FARTHING BIRTHDAY CARD,0.85,United Kingdom,1
ROBOT BIRTHDAY CARD,0.85,United Kingdom,1
BLACK PIRATE TREASURE CHEST,3.36,United Kingdom,1
BROWN  PIRATE TREASURE CHEST ,3.36,United Kingdom,1
RIBBON REEL LACE DESIGN ,4.21,United Kingdom,1
RIBBON REEL POLKADOTS ,3.36,United Kingdom,1
RIBBON REEL STRIPES DESIGN ,3.36,United Kingdom,1
EMPIRE TISSUE BOX,2.51,United Kingdom,1
RED RETROSPOT TISSUE BOX,2.51,United Kingdom,1
LADS ONLY TISSUE BOX,2.51,United Kingdom,1
PINK PAISLEY SQUARE TISSUE BOX ,2.51,United Kingdom,1
BOUDOIR SQUARE TISSUE BOX,2.51,United Kingdom,1
CARAVAN SQUARE TISSUE BOX,2.51,United Kingdom,1
PIZZA PLATE IN BOX,7.62,United Kingdom,1
PING! MICROWAVE PLATE,3.36,United Kingdom,1
METAL SIGN HIS DINNER IS SERVED,5.91,United Kingdom,1
PARTY CONE CHRISTMAS DECORATION ,8.47,United Kingdom,1
FOOD CONTAINER SET 3 LOVE HEART ,4.21,United Kingdom,1
ANGEL DECORATION STARS ON DRESS,0.85,United Kingdom,1
HEART GARLAND RUSTIC PADDED,3.36,United Kingdom,1
PICTURE FRAME WOOD TRIPLE PORTRAIT,13.57,United Kingdom,1
3 HOOK PHOTO SHELF ANTIQUE WHITE,16.98,United Kingdom,1
CAKE STAND VICTORIAN FILIGREE LARGE,8.47,United Kingdom,1
BLUE DINER WALL CLOCK,16.98,United Kingdom,1
LARGE HEART MEASURING SPOONS,3.36,United Kingdom,1
FRYING PAN RED RETROSPOT,8.47,United Kingdom,1
FOUR HOOK  WHITE LOVEBIRDS,4.21,United Kingdom,1
WHITE LOVEBIRD LANTERN,5.91,United Kingdom,1
3 HOOK HANGER MAGIC GARDEN,4.21,United Kingdom,1
FELT EGG COSY BLUE RABBIT ,1.66,United Kingdom,1
FELT EGG COSY WHITE RABBIT ,1.66,United Kingdom,1
FELTCRAFT DOLL ROSIE,5.91,United Kingdom,1
FELTCRAFT DOLL EMILY,5.91,United Kingdom,1
COSMETIC BAG VINTAGE ROSE PAISLEY,4.21,United Kingdom,1
OVERNIGHT BAG VINTAGE ROSE PAISLEY,11.02,United Kingdom,1
HEART FILIGREE DOVE LARGE,3.36,United Kingdom,1
PIG KEYRING WITH LIGHT & SOUND ,2.51,United Kingdom,1
GOLD MUG BONE CHINA TREE OF LIFE,8.47,United Kingdom,1
TEA COSY RED  STRIPE,5.06,United Kingdom,1
IVORY KNITTED MUG COSY ,3.36,United Kingdom,1
OFFICE MUG WARMER POLKADOT,5.91,United Kingdom,1
BIRD DECORATION GREEN POLKADOT,1.66,United Kingdom,1
ROUND SNACK BOXES SET OF 4 FRUITS ,5.91,United Kingdom,1
ROUND CONTAINER SET OF 5 RETROSPOT,3.36,United Kingdom,1
RETROSPOT PARTY BAG + STICKER SET,3.36,United Kingdom,1
DOVE DECORATION PAINTED ZINC ,1.28,United Kingdom,1
ANGEL DECORATION PAINTED ZINC ,1.28,United Kingdom,1
LUNCH BOX WITH CUTLERY RETROSPOT ,5.06,United Kingdom,1
GLASS JAR KINGS CHOICE,5.91,United Kingdom,1
GLASS JAR DAISY FRESH COTTON WOOL,5.91,United Kingdom,1
DOORMAT AIRMAIL ,14.43,United Kingdom,1
CHILDRENS APRON SPACEBOY DESIGN,4.21,United Kingdom,1
AIRLINE BAG VINTAGE TOKYO 78,8.47,United Kingdom,1
WALL TIDY RETROSPOT ,4.21,United Kingdom,1
MONEY BOX POCKET MONEY DESIGN,2.51,United Kingdom,1
METAL SIGN TAKE IT OR LEAVE IT ,5.91,United Kingdom,1
LIPSTICK PEN BABY PINK,0.85,United Kingdom,1
REGENCY CAKESTAND 3 TIER,25.49,United Kingdom,1
WATERING CAN GREEN DINOSAUR,4.21,United Kingdom,1
GROW YOUR OWN BASIL IN ENAMEL MUG,4.21,United Kingdom,1
PENCIL CASE LIFE IS BEAUTIFUL,5.91,United Kingdom,1
SILK PURSE BABUSHKA PINK,6.77,United Kingdom,1
NATURAL SLATE CHALKBOARD LARGE ,10.17,United Kingdom,1
TV DINNER TRAY AIR HOSTESS ,11.02,United Kingdom,1
TV DINNER TRAY DOLLY GIRL,11.02,United Kingdom,1
SPACEBOY TV DINNER TRAY,11.02,United Kingdom,1
RED GINGHAM TEDDY BEAR ,5.91,United Kingdom,1
WHITE WOOD GARDEN PLANT LADDER,20.38,United Kingdom,1
PACK OF 12 TRADITIONAL CRAYONS,0.85,United Kingdom,1
SET OF 2 TINS VINTAGE BATHROOM ,8.47,United Kingdom,1
PICNIC BASKET WICKER LARGE,21.23,United Kingdom,1
CHILDS GARDEN RAKE PINK,4.21,United Kingdom,1
CHILDS GARDEN BRUSH PINK,4.21,United Kingdom,1
CHILDS GARDEN TROWEL PINK,1.66,United Kingdom,1
CHILDRENS GARDEN GLOVES PINK,2.51,United Kingdom,1
MINI JIGSAW DOLLY GIRL,0.85,United Kingdom,1
HEADS AND TAILS SPORTING FUN,2.51,United Kingdom,1
PLASTERS IN TIN WOODLAND ANIMALS,3.36,United Kingdom,1
PLASTERS IN TIN STRONGMAN,3.36,United Kingdom,1
FELTCRAFT HAIRBANDS PINK AND WHITE ,1.66,United Kingdom,1
WOODEN STAR CHRISTMAS SCANDINAVIAN,1.66,United Kingdom,1
ADVENT CALENDAR GINGHAM SACK,11.87,United Kingdom,1
PACK OF 6 BIRDY GIFT TAGS,2.51,United Kingdom,1
FELTCRAFT HAIRBAND PINK AND BLUE,1.66,United Kingdom,1
FELTCRAFT HAIRBAND RED AND BLUE,1.66,United Kingdom,1
CHRISTMAS MUSICAL ZINC HEART ,1.66,United Kingdom,1
CHRISTMAS RETROSPOT ANGEL WOOD,1.66,United Kingdom,1
CHRISTMAS RETROSPOT HEART WOOD,1.66,United Kingdom,1
CHRISTMAS RETROSPOT TREE WOOD,1.66,United Kingdom,1
WOODEN CROQUET GARDEN SET,25.49,United Kingdom,1
PENS ASSORTED SPACEBALL,1.66,United Kingdom,1
SPACEBOY LUNCH BOX ,4.21,United Kingdom,1
CERAMIC STRAWBERRY CAKE MONEY BANK,3.36,United Kingdom,1
TRAVEL SEWING KIT,3.36,United Kingdom,1
BUTTON BOX ,4.21,United Kingdom,1
DOORMAT I LOVE LONDON,14.43,United Kingdom,1
LUNCH BAG DOLLY GIRL DESIGN,4.21,United Kingdom,1
RECIPE BOX BLUE SKETCHBOOK DESIGN,5.91,United Kingdom,1
FRENCH WC SIGN BLUE METAL,2.51,United Kingdom,1
FRENCH BATHROOM SIGN BLUE METAL,3.36,United Kingdom,1
FRENCH TOILET SIGN BLUE METAL,2.51,United Kingdom,1
WICKER WREATH SMALL,3.36,United Kingdom,1
CARD DOLLY GIRL ,0.42,United Kingdom,1
ALARM CLOCK BAKELIKE GREEN,7.62,United Kingdom,1
ALARM CLOCK BAKELIKE RED ,7.62,United Kingdom,1
ALARM CLOCK BAKELIKE PINK,7.62,United Kingdom,1
ALARM CLOCK BAKELIKE ORANGE,7.62,United Kingdom,1
ALARM CLOCK BAKELIKE IVORY,7.62,United Kingdom,1
3D VINTAGE CHRISTMAS STICKERS ,2.51,United Kingdom,1
3D TRADITIONAL CHRISTMAS STICKERS,2.51,United Kingdom,1
RIBBON REEL CHRISTMAS PRESENT ,3.36,United Kingdom,1
RIBBON REEL SNOWY VILLAGE,3.36,United Kingdom,1
FELTCRAFT PRINCESS CHARLOTTE DOLL,7.62,United Kingdom,1
LARGE YELLOW BABUSHKA NOTEBOOK ,2.51,United Kingdom,1
LARGE RED BABUSHKA NOTEBOOK ,2.51,United Kingdom,1
CUPBOARD 3 DRAWER MA CAMPAGNE,29.79,United Kingdom,1
LANTERN CREAM GAZEBO ,11.02,United Kingdom,1
PHOTO FRAME 3 CLASSIC HANGING,21.23,United Kingdom,1
CHEST OF DRAWERS GINGHAM HEART ,34,United Kingdom,1
ANTIQUE GLASS PEDESTAL BOWL,7.62,United Kingdom,1
SET OF 6 T-LIGHTS TOADSTOOLS,5.91,United Kingdom,1
SET OF 6 T-LIGHTS SANTA,5.91,United Kingdom,1
SET OF 6 T-LIGHTS SNOWMEN,5.91,United Kingdom,1
SET OF 6 T-LIGHTS CACTI ,5.91,United Kingdom,1
PACK 3 BOXES CHRISTMAS PANNETONE,4.21,United Kingdom,1
CARD SUKI BIRTHDAY,0.85,United Kingdom,1
ROUND CAKE TIN VINTAGE RED,16.13,United Kingdom,1
FINE WICKER HEART ,2.51,United Kingdom,1
EASTER TIN BUNNY BOUQUET,3.36,United Kingdom,1
SET OF 2 TEA TOWELS APPLE AND PEARS,5.91,United Kingdom,1
CHILDREN'S APRON DOLLY GIRL ,4.21,United Kingdom,1
CALENDAR PAPER CUT DESIGN,5.91,United Kingdom,1
PACK OF 20 NAPKINS RED APPLES,1.66,United Kingdom,1
BLUE COAT RACK PARIS FASHION,11.02,United Kingdom,1
ASSORTED BOTTLE TOP  MAGNETS ,5.06,United Kingdom,1
HERB MARKER ROSEMARY,1.66,United Kingdom,1
HERB MARKER MINT,1.66,United Kingdom,1
HERB MARKER BASIL,1.66,United Kingdom,1
FRIDGE MAGNETS LES ENFANTS ASSORTED,11.02,United Kingdom,1
IVORY GIANT GARDEN THERMOMETER,11.87,United Kingdom,1
GREEN GIANT GARDEN THERMOMETER,11.87,United Kingdom,1
APRON APPLE DELIGHT,11.02,United Kingdom,1
FELTCRAFT CHRISTMAS FAIRY,8.47,United Kingdom,1
CHRISTMAS LIGHTS 10 REINDEER,16.98,United Kingdom,1
CHRISTMAS LIGHTS 10 SANTAS ,8.47,United Kingdom,1
WOODEN ADVENT CALENDAR CREAM,34,United Kingdom,1
WOODEN ADVENT CALENDAR RED,34,United Kingdom,1
CHILDREN'S CIRCUS PARADE MUG,3.36,United Kingdom,1
CIRCUS PARADE CHILDRENS EGG CUP ,2.51,United Kingdom,1
VINTAGE BEAD NOTEBOOK,5.91,United Kingdom,1
YELLOW FELT HANGING HEART W FLOWER,1.66,United Kingdom,1
FOLK ART METAL STAR T-LIGHT HOLDER,1.66,United Kingdom,1
YELLOW BREAKFAST CUP AND SAUCER,5.91,United Kingdom,1
CERAMIC CAKE DESIGN SPOTTED PLATE,3.36,United Kingdom,1
CERAMIC CAKE STAND + HANGING CAKES,21.23,United Kingdom,1
SET/4 2 TONE EGG SHAPE MIXING BOWLS,9.95,United Kingdom,1
WOVEN FROST CUSHION COVER,4.21,United Kingdom,1
SET/6 BEAD COASTERS GAUZE BAG GOLD,5.06,United Kingdom,1
PAIR PADDED HANGERS PINK CHECK,3.36,United Kingdom,1
RAINBOW PEGS PHOTO CLIP STRING,1.49,United Kingdom,1
50CM METAL STRING WITH  7 CLIPS,2.13,United Kingdom,1
ASS FLORAL PRINT SPIRIT LEVEL ,4.21,United Kingdom,1
ENGLISH ROSE GARDEN SECATEURS,8.47,United Kingdom,1
PINK FAIRY CAKE CHILDRENS APRON,4.21,United Kingdom,1
DOORMAT ENGLISH ROSE ,14.43,United Kingdom,1
DOORMAT NEW ENGLAND,14.43,United Kingdom,1
BAG OF SILVER STONES,0.84,United Kingdom,1
SET/6 PINK  BUTTERFLY T-LIGHTS,4.21,United Kingdom,1
SET/3 ROSE CANDLE IN JEWELLED BOX,8.47,United Kingdom,1
BATHROOM METAL SIGN,1.28,United Kingdom,1
FANNY'S REST STOPMETAL SIGN,4.21,United Kingdom,1
"METAL SIGN,CUPCAKE SINGLE HOOK",2.51,United Kingdom,1
RED WOOLLY HOTTIE WHITE HEART.,7.62,United Kingdom,1
PINK/PURPLE RETRO RADIO,4.21,United Kingdom,1
BLUE TV TRAY TABLE ,16.98,United Kingdom,1
ROTATING SILVER ANGELS T-LIGHT HLDR,5.06,United Kingdom,1
CREAM CUPID HEARTS COAT HANGER,6.77,United Kingdom,1
PINK/BLUE DISC/MIRROR STRING,1.66,United Kingdom,1
SET OF 4 POLKADOT PLACEMATS ,7.62,United Kingdom,1
SET OF 4 POLKADOT COASTERS,2.51,United Kingdom,1
TOMATO CHARLIE+LOLA COASTER SET,5.91,United Kingdom,1
3D SHEET OF DOG STICKERS,1.69,United Kingdom,1
3D SHEET OF CAT STICKERS,1.69,United Kingdom,1
PACK 3 IRON ON DOG PATCHES,2.51,United Kingdom,1
PACK 6 HEART/ICE-CREAM PATCHES,2.51,United Kingdom,1
DOG TOY WITH PINK CROCHET SKIRT,4.21,United Kingdom,1
SMALL MARSHMALLOWS PINK BOWL,2.51,United Kingdom,1
BLUE FLY SWAT,1.28,United Kingdom,1
SWEETHEART CARRY-ALL BASKET,16.98,United Kingdom,1
MINT GREEN ROSE TOWEL,3.36,United Kingdom,1
HAND TOWEL PALE BLUE W FLOWERS,4.21,United Kingdom,1
WHITE HAND TOWEL WITH BUTTERFLY,4.21,United Kingdom,1
PINK BUTTERFLY HANDBAG W BOBBLES,4.21,United Kingdom,1
ANTIQUE SILVER TEA GLASS ENGRAVED,2.51,United Kingdom,1
GREEN 3 PIECE POLKADOT CUTLERY SET,7.62,United Kingdom,1
RED 3 PIECE RETROSPOT CUTLERY SET,7.62,United Kingdom,1
RED RETROSPOT UMBRELLA,12.72,United Kingdom,1
ENVELOPE 50 ROMANTIC IMAGES,0.85,United Kingdom,1
ROUND PINK HEART MIRROR,4.21,United Kingdom,1
3 ROSE MORRIS BOXED CANDLES,8.47,United Kingdom,1
ROSE 3 WICK MORRIS BOX CANDLE,8.47,United Kingdom,1
15CM CHRISTMAS GLASS BALL 20 LIGHTS,16.98,United Kingdom,1
ROMANTIC PINKS RIBBONS ,2.51,United Kingdom,1
CANDY SPOT CUSHION COVER,8.47,United Kingdom,1
CANDY SPOT EGG WARMER RABBIT,2.51,United Kingdom,1
BEADED PEARL HEART WHITE ON STICK,0.85,United Kingdom,1
BLUE DRAGONFLY HELICOPTER,8.47,United Kingdom,1
CACTI T-LIGHT CANDLES,13.57,United Kingdom,1
BASKET OF FLOWERS SEWING KIT,1.66,United Kingdom,1
VICTORIAN SEWING KIT,2.51,United Kingdom,1
