Description,UnitPrice,Country,Quantity
ROTATING SILVER ANGELS T-LIGHT HLDR,0.03,United Kingdom,-9360
HEART WOODEN CHRISTMAS DECORATION,0.72,United Kingdom,-192
CARD HOLDER GINGHAM HEART,2.1,United Kingdom,-192
CHRISTMAS GINGHAM STAR,0.72,United Kingdom,-144
CHRISTMAS GINGHAM HEART,0.72,United Kingdom,-144
PARTY CONE CHRISTMAS DECORATION ,0.72,United Kingdom,-144
HAND WARMER BABUSHKA DESIGN,2.1,United Kingdom,-72
DOORMAT MERRY CHRISTMAS RED ,6.75,United Kingdom,-50
CARDHOLDER GINGHAM CHRISTMAS TREE,2.55,United Kingdom,-50
CHRISTMAS LIGHTS 10 SANTAS ,7.65,United Kingdom,-48
ADVENT CALENDAR GINGHAM SACK,4.95,United Kingdom,-48
RED STAR CARD HOLDER,2.55,United Kingdom,-48
damages,0,United Kingdom,-43
WOODEN STAR CHRISTMAS SCANDINAVIAN,0.85,United Kingdom,-36
HANGING BAUBLE T-LIGHT HOLDER SMALL,2.1,United Kingdom,-36
HAND WARMER OWL DESIGN,2.1,United Kingdom,-36
check,0,United Kingdom,-35
PACK OF 12 PINK PAISLEY TISSUES ,0.29,United Kingdom,-24
PACK OF 12 BLUE PAISLEY TISSUES ,0.29,United Kingdom,-24
PACK OF 12 RED RETROSPOT TISSUES ,0.29,United Kingdom,-24
PLASTERS IN TIN SKULLS,1.65,United Kingdom,-24
FOLKART STAR CHRISTMAS DECORATIONS,1.25,United Kingdom,-24
BLUE HARMONICA IN BOX ,1.25,United Kingdom,-24
BUTTON BOX ,1.95,United Kingdom,-20
check,0,United Kingdom,-20
PLASTERS IN TIN CIRCUS PARADE ,1.65,United Kingdom,-12
CHICK GREY HOT WATER BOTTLE,3.45,United Kingdom,-12
PLASTERS IN TIN VINTAGE PAISLEY ,1.65,United Kingdom,-12
KINGS CHOICE GIANT TUBE MATCHES,2.55,United Kingdom,-12
SMALL HEART MEASURING SPOONS,0.85,United Kingdom,-12
SMALL HEART MEASURING SPOONS,0.85,United Kingdom,-12
VICTORIAN SEWING BOX LARGE,10.95,United Kingdom,-12
MAGIC DRAWING SLATE PURDEY,0.42,United Kingdom,-11
10 COLOUR SPACEBOY PEN,0.85,United Kingdom,-11
HAND WARMER OWL DESIGN,2.1,United Kingdom,-10
RED RETROSPOT CAKE STAND,9.95,United Kingdom,-10
REGENCY CAKESTAND 3 TIER,10.95,United Kingdom,-10
ROTATING SILVER ANGELS T-LIGHT HLDR,2.55,United Kingdom,-9
CHALKBOARD KITCHEN ORGANISER,21.95,United Kingdom,-8
4 TRADITIONAL SPINNING TOPS,1.25,United Kingdom,-8
MEASURING TAPE BABUSHKA RED,2.95,United Kingdom,-8
CHRISTMAS CRAFT TREE TOP ANGEL,2.1,United Kingdom,-8
ADVENT CALENDAR GINGHAM SACK,5.95,United Kingdom,-8
SILVER HANGING T-LIGHT HOLDER,1.65,United Kingdom,-8
SET OF SALT AND PEPPER TOADSTOOLS,1.25,Germany,-7
10 COLOUR SPACEBOY PEN,0.85,United Kingdom,-7
JAM MAKING SET WITH JARS,4.25,United Kingdom,-6
6 RIBBONS RUSTIC CHARM,1.65,Germany,-6
IVORY PILLAR CANDLE SILVER FLOCK,2.95,United Kingdom,-6
METAL MERRY CHRISTMAS WREATH,1.95,United Kingdom,-6
POPPY'S PLAYHOUSE BATHROOM,2.1,United Kingdom,-6
CHRISTMAS LIGHTS 10 VINTAGE BAUBLES,4.95,United Kingdom,-6
TEA TIME DES TEA COSY,2.55,United Kingdom,-6
TEA TIME DES TEA COSY,2.55,United Kingdom,-6
PAPER CHAIN KIT 50'S CHRISTMAS ,2.95,United Kingdom,-6
GARLAND WITH HEARTS AND BELLS,4.95,United Kingdom,-6
5 HOOK HANGER MAGIC TOADSTOOL,1.65,Germany,-5
ALPHABET STENCIL CRAFT,1.25,United Kingdom,-5
FELTCRAFT CHRISTMAS FAIRY,4.25,United Kingdom,-5
SILVER HANGING T-LIGHT HOLDER,1.65,United Kingdom,-5
3 HOOK HANGER MAGIC GARDEN,1.95,Germany,-4
LIGHT GARLAND BUTTERFILES PINK,4.25,United Kingdom,-4
RED RETROSPOT TRADITIONAL TEAPOT ,7.95,United Kingdom,-4
ROUND SNACK BOXES SET OF 4 SKULLS,2.95,United Kingdom,-4
RED  HARMONICA IN BOX ,1.25,United Kingdom,-4
POPPY'S PLAYHOUSE KITCHEN,2.1,United Kingdom,-4
EIGHT PIECE DINOSAUR SET,1.25,United Kingdom,-4
IVY HEART WREATH,6.75,United Kingdom,-4
CHILDS BREAKFAST SET CIRCUS PARADE,8.5,Germany,-4
IVORY GIANT GARDEN THERMOMETER,5.95,United Kingdom,-4
GREEN GIANT GARDEN THERMOMETER,5.95,United Kingdom,-4
BREAD BIN DINER STYLE MINT,14.95,United Kingdom,-4
BREAD BIN DINER STYLE IVORY,14.95,United Kingdom,-4
IVORY GIANT GARDEN THERMOMETER,5.95,United Kingdom,-4
GREEN GIANT GARDEN THERMOMETER,5.95,United Kingdom,-4
BREAD BIN DINER STYLE IVORY,14.95,United Kingdom,-4
BREAD BIN DINER STYLE MINT,14.95,United Kingdom,-4
LUNCH BOX I LOVE LONDON,1.65,United Kingdom,-4
ZINC TOP  2 DOOR WOODEN SHELF ,14.95,United Kingdom,-4
CLEAR MILKSHAKE GLASS,1.65,United Kingdom,-4
FELTCRAFT DOLL MOLLY,2.95,United Kingdom,-3
SET OF 3 BLACK FLYING DUCKS,4.65,United Kingdom,-3
RED RETROSPOT TRADITIONAL TEAPOT ,6.95,United Kingdom,-3
ANTIQUE SILVER TEA GLASS ETCHED,1.25,United Kingdom,-3
CUPBOARD 3 DRAWER MA CAMPAGNE,12.75,United Kingdom,-3
TRADITIONAL WOODEN SKIPPING ROPE,1.25,United Kingdom,-3
FAIRY TALE COTTAGE NIGHTLIGHT,1.95,United Kingdom,-3
GUMBALL MONOCHROME COAT RACK,1.06,United Kingdom,-3
GLASS STAR FROSTED T-LIGHT HOLDER,4.95,United Kingdom,-3
BLUE PADDED SOFT MOBILE,4.25,Germany,-3
15CM CHRISTMAS GLASS BALL 20 LIGHTS,6.95,United Kingdom,-3
CHARLOTTE BAG SUKI DESIGN,0.85,United Kingdom,-2
TRIPLE PHOTO FRAME CORNICE ,9.95,Germany,-2
"HOOK, 1 HANGER ,MAGIC GARDEN",0.85,Germany,-2
ORGANISER WOOD ANTIQUE WHITE ,8.5,Germany,-2
SET/5 RED RETROSPOT LID GLASS BOWLS,2.95,United Kingdom,-2
SET 7 BABUSHKA NESTING BOXES,8.5,Germany,-2
3 TIER CAKE TIN GREEN AND CREAM,14.95,United Kingdom,-2
ANTIQUE GLASS DRESSING TABLE POT,2.95,United Kingdom,-2
PICNIC BASKET WICKER LARGE,9.95,United Kingdom,-2
RED RETROSPOT TRADITIONAL TEAPOT ,7.95,United Kingdom,-2
CREAM SWEETHEART MINI CHEST,12.75,United Kingdom,-2
SILVER FISHING GNOME ,6.95,United Kingdom,-2
BREAD BIN DINER STYLE IVORY,16.95,United Kingdom,-2
SMALL POPCORN HOLDER,0.85,United Kingdom,-2
SET OF 3 BLACK FLYING DUCKS,4.65,United Kingdom,-2
BROCANTE COAT RACK,8.5,United Kingdom,-2
PINK GLASS CANDLEHOLDER,2.95,United Kingdom,-2
CHEST 7 DRAWER MA CAMPAGNE,21.95,United Kingdom,-2
SWEETHEART CARRY-ALL BASKET,8.5,Italy,-2
ENAMEL MEASURING JUG CREAM,4.25,United Kingdom,-2
S/6 WOODEN SKITTLES IN COTTON BAG,2.95,United Kingdom,-2
PAPER CHAIN KIT LONDON,2.95,United Kingdom,-2
ROUND SNACK BOXES SET OF 4 FRUITS ,2.95,United Kingdom,-2
WHITE BEADED GARLAND STRING 20LIGHT,6.35,United Kingdom,-2
ALARM CLOCK BAKELIKE GREEN,3.75,United Kingdom,-2
ROSE COTTAGE KEEPSAKE BOX ,9.95,United Kingdom,-2
REGENCY CAKESTAND 3 TIER,10.95,United Kingdom,-2
REGENCY CAKESTAND 3 TIER,10.95,United Kingdom,-2
WHITE BAMBOO RIBS LAMPSHADE,0.64,United Kingdom,-2
Discount,27.5,United Kingdom,-1
SET OF 3 COLOURED  FLYING DUCKS,4.65,United Kingdom,-1
HAND WARMER RED RETROSPOT,2.1,United Kingdom,-1
SET/5 RED RETROSPOT LID GLASS BOWLS,2.95,Germany,-1
DELUXE SEWING KIT ,5.95,Germany,-1
RETROSPOT PARTY BAG + STICKER SET,1.65,Germany,-1
CIRCUS PARADE LUNCH BOX ,1.95,Germany,-1
MIRRORED DISCO BALL ,5.95,United Kingdom,-1
15CM CHRISTMAS GLASS BALL 20 LIGHTS,7.95,United Kingdom,-1
SMALL GLASS HEART TRINKET POT,2.1,United Kingdom,-1
PINK OWL SOFT TOY,2.95,United Kingdom,-1
GLASS CLOCHE SMALL,3.95,United Kingdom,-1
VICTORIAN SEWING BOX LARGE,12.75,United Kingdom,-1
CACTI T-LIGHT CANDLES,0.42,United Kingdom,-1
VICTORIAN GLASS HANGING T-LIGHT,1.25,United Kingdom,-1
GREEN CHRISTMAS TREE CARD HOLDER,4.25,EIRE,-1
COLOUR GLASS. STAR T-LIGHT HOLDER,3.25,EIRE,-1
ANTIQUE SILVER TEA GLASS ENGRAVED,1.25,United Kingdom,-1
NUMBER TILE COTTAGE GARDEN 9,1.95,United Kingdom,-1
NUMBER TILE COTTAGE GARDEN 1,1.95,United Kingdom,-1
NUMBER TILE COTTAGE GARDEN No,2.1,United Kingdom,-1
RED RETROSPOT CAKE STAND,10.95,United Kingdom,-1
SET/3 RED GINGHAM ROSE STORAGE BOX,3.75,United Kingdom,-1
BAKING SET SPACEBOY DESIGN,4.95,United Kingdom,-1
BROCANTE SHELF WITH HOOKS,10.75,United Kingdom,-1
COLOUR GLASS. STAR T-LIGHT HOLDER,3.25,United Kingdom,-1
CLASSICAL ROSE SMALL VASE,2.55,United Kingdom,-1
3 HEARTS HANGING DECORATION RUSTIC,2.95,United Kingdom,-1
CHRISTMAS METAL POSTCARD WITH BELLS,1.25,United Kingdom,-1
SAVE THE PLANET MUG,1.25,United Kingdom,-1
SWEETHEART CAKESTAND 3 TIER,9.95,United Kingdom,-1
BEACH HUT KEY CABINET,3.75,United Kingdom,-1
DOLLY GIRL LUNCH BOX,1.95,United Kingdom,-1
CREAM SWEETHEART EGG HOLDER,4.95,United Kingdom,-1
FORKED CACTUS CANDLE,2.95,United Kingdom,-1
CACTI T-LIGHT CANDLES,0.42,United Kingdom,-1
ASSTD DESIGN RACING CAR PEN,1.69,United Kingdom,-1
CAKE STAND VICTORIAN FILIGREE LARGE,8.5,United Kingdom,-1
DOORMAT RED RETROSPOT,7.95,United Kingdom,-1
Discount,29.29,United Kingdom,-1
CERAMIC CAKE STAND + HANGING CAKES,9.95,United Kingdom,-1
WOODLAND STORAGE BOX LARGE ,2.95,United Kingdom,-1
WOODEN BOX ADVENT CALENDAR ,8.95,United Kingdom,-1
REGENCY CAKESTAND 3 TIER,12.75,United Kingdom,-1
GLASS  BEURRE DISH,3.95,United Kingdom,-1
SMALL POPCORN HOLDER,0.85,United Kingdom,-1
AIRLINE BAG VINTAGE TOKYO 78,4.25,United Kingdom,-1
ENAMEL WATERING CAN CREAM,4.95,United Kingdom,-1
POSTAGE,4.41,United Kingdom,-1
ROUND CAKE TIN VINTAGE RED,7.95,United Kingdom,-1
JAM MAKING SET WITH JARS,4.25,United Kingdom,-1
LOVE BUILDING BLOCK WORD,5.95,United Kingdom,-1
RED RETROSPOT TRADITIONAL TEAPOT ,7.95,United Kingdom,-1
Bank Charges,95.38,United Kingdom,-1
SAMPLES,12.95,United Kingdom,-1
SAMPLES,52,United Kingdom,-1
Discount,281,United Kingdom,-1
AMAZON FEE,1,United Kingdom,-1
JUMBO BAG RED RETROSPOT,1.65,United Kingdom,-1
VINTAGE UNION JACK CUSHION COVER,4.95,United Kingdom,-1
CHRISTMAS PUDDING TRINKET POT ,1.25,United Kingdom,-1
LARGE CAKE STAND  HANGING STRAWBERY,8.5,United Kingdom,-1
DELUXE SEWING KIT ,4.95,United Kingdom,-1
WHITE HANGING HEART T-LIGHT HOLDER,2.55,United Kingdom,-1
RECIPE BOX BLUE SKETCHBOOK DESIGN,2.95,United Kingdom,-1
SMALL POPCORN HOLDER,0.72,United Kingdom,-1
FAMILY ALBUM WHITE PICTURE FRAME,7.65,United Kingdom,-1
RED RETROSPOT CAKE STAND,9.95,United Kingdom,-1
PINK HEART SHAPE EGG FRYING PAN,1.25,United Kingdom,-1
LARGE POPCORN HOLDER ,1.45,United Kingdom,-1
Manual,631.31,United Kingdom,-1
Manual,313.78,United Kingdom,-1
AMAZON FEE,13541.33,United Kingdom,-1
AMAZON FEE,13474.79,United Kingdom,-1
AMAZON FEE,5519.25,United Kingdom,-1
AMAZON FEE,13541.33,United Kingdom,-1
AMAZON FEE,6706.71,United Kingdom,-1
COOK WITH WINE METAL SIGN ,1.95,United Kingdom,-1
COFFEE MUG CAT + BIRD DESIGN,2.55,United Kingdom,-1
ALARM CLOCK BAKELIKE IVORY,3.75,United Kingdom,-1
HEART DECORATION WITH PEARLS ,0.85,United Kingdom,-1
SKULL LUNCH BOX WITH CUTLERY ,2.55,United Kingdom,-1
COLOUR GLASS. STAR T-LIGHT HOLDER,3.25,United Kingdom,-1
CREAM SWEETHEART SHELF + HOOKS,7.95,United Kingdom,-1
CARNIVAL BRACELET,12.75,United Kingdom,-1
BLACK PHOTO ALBUM ,5.55,United Kingdom,-1
PICNIC BASKET WICKER LARGE,8.5,United Kingdom,-1
HEART OF WICKER SMALL,1.45,United Kingdom,-1
KINGS CHOICE BISCUIT TIN,4.25,United Kingdom,-1
SET OF 3 COLOURED  FLYING DUCKS,4.65,United Kingdom,-1
WHITE BEADED GARLAND STRING 20LIGHT,5.55,United Kingdom,-1
LARGE POPCORN HOLDER ,1.45,United Kingdom,-1
SMALL POPCORN HOLDER,0.72,United Kingdom,-1
GLITTER HANGING BUTTERFLY STRING,2.1,United Kingdom,-1
ROCKING HORSE RED CHRISTMAS ,0.85,United Kingdom,-1
ANTIQUE GLASS HEART DECORATION ,1.95,United Kingdom,-1
MINT KITCHEN SCALES,8.5,United Kingdom,-1
PHOTO CLIP LINE,1.25,United Kingdom,1
FELT EGG COSY CHICKEN,0.85,United Kingdom,1
PIGGY BANK RETROSPOT ,2.55,United Kingdom,1
COOK WITH WINE METAL SIGN ,1.95,United Kingdom,1
YELLOW BREAKFAST CUP AND SAUCER,2.95,United Kingdom,1
PINK BREAKFAST CUP AND SAUCER ,2.95,United Kingdom,1
PAPER CHAIN KIT RETROSPOT,2.95,United Kingdom,1
FELT EGG COSY WHITE RABBIT ,0.85,United Kingdom,1
ZINC WILLIE WINKIE  CANDLE STICK,0.85,United Kingdom,1
CERAMIC CHERRY CAKE MONEY BANK,1.45,United Kingdom,1
RETROSPOT LARGE MILK JUG,4.95,United Kingdom,1
BLUE OWL SOFT TOY,2.95,United Kingdom,1
BALLOON ART MAKE YOUR OWN FLOWERS,1.95,United Kingdom,1
SET 3 WICKER OVAL BASKETS W LIDS,19.95,United Kingdom,1
RUSTIC  SEVENTEEN DRAWER SIDEBOARD,165,United Kingdom,1
BIRD HOUSE HOT WATER BOTTLE,2.55,United Kingdom,1
BOUDOIR SQUARE TISSUE BOX,1.25,United Kingdom,1
PHOTO FRAME CORNICE,2.95,United Kingdom,1
SILK PURSE BABUSHKA RED,3.35,United Kingdom,1
PICTURE DOMINOES,1.45,United Kingdom,1
S/6 SEW ON CROCHET FLOWERS,1.25,United Kingdom,1
BALLOONS  WRITING SET ,1.65,United Kingdom,1
LAVENDER INCENSE IN TIN,1.25,United Kingdom,1
TV DINNER TRAY VINTAGE PAISLEY,4.95,United Kingdom,1
FAMILY PHOTO FRAME CORNICE,9.95,United Kingdom,1
MIRRORED DISCO BALL ,5.95,United Kingdom,1
DISCO BALL ROTATOR BATTERY OPERATED,4.25,United Kingdom,1
LADIES & GENTLEMEN METAL SIGN,2.55,United Kingdom,1
METAL SIGN HER DINNER IS SERVED ,2.95,United Kingdom,1
DOORMAT TOPIARY,7.95,United Kingdom,1
BATHROOM METAL SIGN,0.55,United Kingdom,1
KITCHEN METAL SIGN,0.55,United Kingdom,1
GROW YOUR OWN BASIL IN ENAMEL MUG,2.1,United Kingdom,1
SET/10 PINK POLKADOT PARTY CANDLES,1.25,United Kingdom,1
SET 20 NAPKINS FAIRY CAKES DESIGN ,0.85,United Kingdom,1
SET OF 6 T-LIGHTS SNOWMEN,2.95,United Kingdom,1
SET OF 6 T-LIGHTS SANTA,2.95,United Kingdom,1
APPLE BATH SPONGE,1.25,United Kingdom,1
STRAWBERRY BATH SPONGE ,1.25,United Kingdom,1
PINK OVAL JEWELLED MIRROR,5.95,United Kingdom,1
RETROSPOT CIGAR BOX MATCHES ,1.25,United Kingdom,1
LUNCH BAG DOLLY GIRL DESIGN,1.65,United Kingdom,1
WOOD 2 DRAWER CABINET WHITE FINISH,5.95,United Kingdom,1
ASSORTED COLOUR MINI CASES,7.95,United Kingdom,1
LUNCH BAG RED RETROSPOT,1.65,United Kingdom,1
LUNCH BAG WOODLAND,1.65,United Kingdom,1
LUNCH BAG PINK POLKADOT,1.65,United Kingdom,1
BREAD BIN DINER STYLE PINK,16.95,United Kingdom,1
TEA TIME TABLE CLOTH,10.65,United Kingdom,1
ENGLISH ROSE HOT WATER BOTTLE,4.25,United Kingdom,1
POSTAGE,15,Netherlands,1
WHITE SKULL HOT WATER BOTTLE ,3.75,United Kingdom,1
SCOTTIE DOG HOT WATER BOTTLE,4.95,United Kingdom,1
SQUARECUSHION COVER PINK UNION FLAG,6.75,United Kingdom,1
SPACEBOY CHILDRENS EGG CUP,1.25,United Kingdom,1
CHILDREN'S SPACEBOY MUG,1.65,United Kingdom,1
HAND WARMER SCOTTY DOG DESIGN,2.1,United Kingdom,1
FELTCRAFT CUSHION OWL,3.75,United Kingdom,1
BLACK CANDELABRA T-LIGHT HOLDER,2.1,United Kingdom,1
TOY TIDY DOLLY GIRL DESIGN,2.1,United Kingdom,1
SET 12 LAVENDER  BOTANICAL T-LIGHTS,2.95,United Kingdom,1
UNION JACK FLAG LUGGAGE TAG,1.25,United Kingdom,1
RED HEART LUGGAGE TAG,1.25,United Kingdom,1
RED GLASS TASSLE BAG CHARM,2.95,United Kingdom,1
CLEAR ACRYLIC FACETED BANGLE,2.95,United Kingdom,1
5 STRAND GLASS NECKLACE CRYSTAL,6.35,United Kingdom,1
DOORMAT UNION JACK GUNS AND ROSES,7.95,United Kingdom,1
VANILLA SCENT CANDLE JEWELLED BOX,4.25,United Kingdom,1
FULL ENGLISH BREAKFAST PLATE,3.75,United Kingdom,1
MAGIC DRAWING SLATE CIRCUS PARADE  ,0.42,United Kingdom,1
CHRISTMAS HANGING HEART WITH BELL,1.25,United Kingdom,1
CAKE STAND VICTORIAN FILIGREE MED,6.75,United Kingdom,1
PINK NEW BAROQUECANDLESTICK CANDLE,2.95,United Kingdom,1
PINK B'FLY C/COVER W BOBBLES,5.95,United Kingdom,1
PINK UNION JACK  LUGGAGE TAG,1.25,United Kingdom,1
6 RIBBONS ELEGANT CHRISTMAS ,1.65,United Kingdom,1
UNION JACK FLAG LUGGAGE TAG,1.25,United Kingdom,1
BOOM BOX SPEAKER GIRLS,5.95,United Kingdom,1
6 RIBBONS SHIMMERING PINKS ,1.65,United Kingdom,1
 SET 2 TEA TOWELS I LOVE LONDON ,2.95,United Kingdom,1
JUMBO BAG OWLS,1.95,United Kingdom,1
OWL DOORSTOP,4.95,United Kingdom,1
HAND WARMER UNION JACK,2.1,United Kingdom,1
HAND WARMER SCOTTY DOG DESIGN,2.1,United Kingdom,1
LARGE POPCORN HOLDER ,1.65,United Kingdom,1
JUMBO BAG STRAWBERRY,1.95,United Kingdom,1
STRAWBERRY SHOPPER BAG,1.25,United Kingdom,1
STRAWBERRY CHARLOTTE BAG,0.85,United Kingdom,1
 SET 2 TEA TOWELS I LOVE LONDON ,2.95,United Kingdom,1
SCOTTIE DOG HOT WATER BOTTLE,4.95,United Kingdom,1
CHOCOLATE HOT WATER BOTTLE,4.95,United Kingdom,1
ROUND SNACK BOXES SET OF4 WOODLAND ,2.95,United Kingdom,1
ROUND SNACK BOXES SET OF 4 FRUITS ,2.95,United Kingdom,1
ROUND SNACK BOXES SET OF 4 SKULLS,2.95,United Kingdom,1
DOLLY GIRL LUNCH BOX,1.95,United Kingdom,1
SPACEBOY LUNCH BOX ,1.95,United Kingdom,1
GREEN POLKADOT PLATE ,1.69,United Kingdom,1
BLUE POLKADOT PLATE ,1.69,United Kingdom,1
RED RETROSPOT PLATE ,1.69,United Kingdom,1
PINK  POLKADOT PLATE ,1.69,United Kingdom,1
ROUND SNACK BOXES SET OF 4 SKULLS,2.95,United Kingdom,1
FELTCRAFT DOLL MOLLY,2.95,United Kingdom,1
SET OF 3 NOTEBOOKS IN PARCEL,1.65,United Kingdom,1
COSY SLIPPER SHOES SMALL  RED ,2.95,United Kingdom,1
6 RIBBONS RUSTIC CHARM,1.65,United Kingdom,1
FELTCRAFT CHRISTMAS FAIRY,4.25,United Kingdom,1
FELTCRAFT PRINCESS CHARLOTTE DOLL,3.75,United Kingdom,1
SCANDINAVIAN REDS RIBBONS,1.25,United Kingdom,1
CHRISTMAS CRAFT TREE TOP ANGEL,2.1,United Kingdom,1
12 DAISY PEGS IN WOOD BOX,1.65,United Kingdom,1
5 HOOK HANGER RED MAGIC TOADSTOOL,1.65,United Kingdom,1
FELTCRAFT DOLL MOLLY,2.95,United Kingdom,1
FELTCRAFT PRINCESS CHARLOTTE DOLL,3.75,United Kingdom,1
REX CASH+CARRY JUMBO SHOPPER,0.95,United Kingdom,1
CHRISTMAS CRAFT TREE TOP ANGEL,2.1,United Kingdom,1
CHRISTMAS CRAFT LITTLE FRIENDS,2.1,United Kingdom,1
12 DAISY PEGS IN WOOD BOX,1.65,United Kingdom,1
PAPER CHAIN KIT 50'S CHRISTMAS ,2.95,United Kingdom,1
FOLDING UMBRELLA PINKWHITE POLKADOT,4.95,United Kingdom,1
FOLDING UMBRELLA CREAM POLKADOT,4.95,United Kingdom,1
FOLDING UMBRELLA WHITE/RED POLKADOT,4.95,United Kingdom,1
FOLDING UMBRELLA RED/WHITE POLKADOT,4.95,United Kingdom,1
LUNCH BAG RED RETROSPOT,1.65,United Kingdom,1
S/4 VALENTINE DECOUPAGE HEART BOX,2.95,United Kingdom,1
FOLDING UMBRELLA CREAM POLKADOT,4.95,United Kingdom,1
HEART OF WICKER LARGE,2.95,United Kingdom,1
ADVENT CALENDAR GINGHAM SACK,5.95,United Kingdom,1
PURPLE DRAWERKNOB ACRYLIC EDWARDIAN,1.25,United Kingdom,1
RETROSPOT CHILDRENS APRON,1.95,United Kingdom,1
DIAMANTE HAIR GRIP PACK/2 MONTANA,1.65,United Kingdom,1
BLUE SWEETHEART BRACELET,4.25,United Kingdom,1
PURPLE SWEETHEART BRACELET,4.25,United Kingdom,1
JUMBO BAG PINK POLKADOT,1.95,United Kingdom,1
JUMBO BAG RED RETROSPOT,1.95,United Kingdom,1
PAPER CHAIN KIT 50'S CHRISTMAS ,2.95,United Kingdom,1
RIBBON REEL CHRISTMAS PRESENT ,1.65,United Kingdom,1
FIRST AID TIN,3.25,United Kingdom,1
PACK OF 12 HEARTS DESIGN TISSUES ,0.29,United Kingdom,1
PACK OF 12 RED RETROSPOT TISSUES ,0.29,United Kingdom,1
SOLDIERS EGG CUP ,1.25,United Kingdom,1
HEART IVORY TRELLIS SMALL,1.25,United Kingdom,1
HEART FILIGREE DOVE  SMALL,1.25,United Kingdom,1
HEART FILIGREE DOVE LARGE,1.65,United Kingdom,1
PACK OF 60 PINK PAISLEY CAKE CASES,0.55,United Kingdom,1
SET OF 6 SOLDIER SKITTLES,3.75,United Kingdom,1
SWIRLY CIRCULAR RUBBERS IN BAG,0.42,United Kingdom,1
VINTAGE PAISLEY STATIONERY SET,2.95,United Kingdom,1
PAPER CHAIN KIT VINTAGE CHRISTMAS,2.95,United Kingdom,1
SET/10 BLUE POLKADOT PARTY CANDLES,1.25,United Kingdom,1
SET OF 6 T-LIGHTS SNOWMEN,2.95,United Kingdom,1
STAR WOODEN CHRISTMAS DECORATION,0.85,United Kingdom,1
WOODEN HEART CHRISTMAS SCANDINAVIAN,0.85,United Kingdom,1
SET OF 6 T-LIGHTS SANTA,2.95,United Kingdom,1
SET/9 CHRISTMAS T-LIGHTS SCENTED ,1.25,United Kingdom,1
BLUE ROSE FABRIC MIRROR,1.25,United Kingdom,1
THREE CANVAS LUGGAGE TAGS,1.95,United Kingdom,1
RETROSPOT PARTY BAG + STICKER SET,1.65,United Kingdom,1
PLASTERS IN TIN VINTAGE PAISLEY ,1.65,United Kingdom,1
RETROSPOT SMALL TUBE MATCHES,1.65,United Kingdom,1
HAND WARMER SCOTTY DOG DESIGN,2.1,United Kingdom,1
HAND WARMER SCOTTY DOG DESIGN,2.1,United Kingdom,1
36 FOIL HEART CAKE CASES,2.1,United Kingdom,1
PACK OF 6 SWEETIE GIFT BOXES,2.55,United Kingdom,1
PACK OF 72 RETROSPOT CAKE CASES,0.55,United Kingdom,1
SET/10 RED POLKADOT PARTY CANDLES,1.25,United Kingdom,1
SET/10 PINK POLKADOT PARTY CANDLES,1.25,United Kingdom,1
SET OF 3 NOTEBOOKS IN PARCEL,1.65,United Kingdom,1
STAR  T-LIGHT HOLDER ,1.45,United Kingdom,1
MAKE YOUR OWN PLAYTIME CARD KIT,2.95,United Kingdom,1
DINOSAURS  WRITING SET ,1.65,United Kingdom,1
BALLOONS  WRITING SET ,1.65,United Kingdom,1
SKULLS WRITING SET ,1.65,United Kingdom,1
VINTAGE PAISLEY STATIONERY SET,2.95,United Kingdom,1
COSY SLIPPER SHOES SMALL  RED ,2.95,United Kingdom,1
DOORMAT BLACK FLOCK ,7.95,United Kingdom,1
JUMBO  BAG BAROQUE BLACK WHITE,1.95,United Kingdom,1
JAM MAKING SET WITH JARS,4.25,United Kingdom,1
ORANGE SCENTED SET/9 T-LIGHTS,0.85,United Kingdom,1
HAND WARMER SCOTTY DOG DESIGN,2.1,United Kingdom,1
CHRISTMAS DECOUPAGE CANDLE,0.85,United Kingdom,1
GROW YOUR OWN BASIL IN ENAMEL MUG,2.1,United Kingdom,1
OFFICE MUG WARMER POLKADOT,2.95,United Kingdom,1
JUMBO BAG DOLLY GIRL DESIGN,1.95,United Kingdom,1
VINTAGE UNION JACK BUNTING,8.5,United Kingdom,1
RETRO LONGBOARD IRONING BOARD COVER,3.75,United Kingdom,1
3D DOG PICTURE PLAYING CARDS,2.95,United Kingdom,1
RETROSPOT CIGAR BOX MATCHES ,1.25,United Kingdom,1
ROTATING SILVER ANGELS T-LIGHT HLDR,2.55,United Kingdom,1
ROTATING SILVER ANGELS T-LIGHT HLDR,2.55,United Kingdom,1
SAVE THE PLANET COTTON TOTE BAG,2.25,United Kingdom,1
SET OF 20 VINTAGE CHRISTMAS NAPKINS,0.85,United Kingdom,1
PAPER BUNTING WHITE LACE,2.95,United Kingdom,1
PAPER CHAIN KIT VINTAGE CHRISTMAS,2.95,United Kingdom,1
MIRRORED WALL ART GENTS,2.55,United Kingdom,1
AIRLINE BAG VINTAGE JET SET WHITE,4.25,United Kingdom,1
JAM MAKING SET PRINTED,1.45,United Kingdom,1
POTTING SHED SOW 'N' GROW SET,4.25,United Kingdom,1
BABUSHKA LIGHTS STRING OF 10,6.75,United Kingdom,1
REX CASH+CARRY JUMBO SHOPPER,0.95,United Kingdom,1
AIRLINE BAG VINTAGE WORLD CHAMPION ,4.25,United Kingdom,1
HAND WARMER BIRD DESIGN,2.1,United Kingdom,1
CHRISTMAS CRAFT LITTLE FRIENDS,2.1,United Kingdom,1
PINK HEARTS PAPER GARLAND,1.65,United Kingdom,1
FELTCRAFT CHRISTMAS FAIRY,4.25,United Kingdom,1
HI TEC ALPINE HAND WARMER,1.65,United Kingdom,1
3 STRIPEY MICE FELTCRAFT,1.95,United Kingdom,1
CLASSIC FRENCH STYLE BASKET NATURAL,6.75,United Kingdom,1
CRAZY DAISY HEART DECORATION,1.25,United Kingdom,1
GIN + TONIC DIET METAL SIGN,2.1,United Kingdom,1
IVORY GIANT GARDEN THERMOMETER,5.95,United Kingdom,1
S/6 WOODEN SKITTLES IN COTTON BAG,2.95,United Kingdom,1
FRENCH WC SIGN BLUE METAL,1.25,United Kingdom,1
PINK UNION JACK  LUGGAGE TAG,1.25,United Kingdom,1
"TRAY, BREAKFAST IN BED",12.75,United Kingdom,1
HEART OF WICKER LARGE,2.95,United Kingdom,1
PINK HEART DOTS HOT WATER BOTTLE,3.75,United Kingdom,1
PLASTERS IN TIN SKULLS,1.65,United Kingdom,1
PLASTERS IN TIN SPACEBOY,1.65,United Kingdom,1
BUTTON BOX ,1.95,United Kingdom,1
SMALL RED BABUSHKA NOTEBOOK ,0.85,United Kingdom,1
HERB MARKER ROSEMARY,0.65,United Kingdom,1
HERB MARKER THYME,0.65,United Kingdom,1
METAL MERRY CHRISTMAS WREATH,1.95,United Kingdom,1
GROW YOUR OWN BASIL IN ENAMEL MUG,2.1,United Kingdom,1
BLUE PAISLEY TISSUE BOX,1.25,United Kingdom,1
HEART OF WICKER SMALL,1.65,United Kingdom,1
SKULLS SQUARE TISSUE BOX,1.25,United Kingdom,1
PINK PAISLEY SQUARE TISSUE BOX ,1.25,United Kingdom,1
PACK OF 6 HANDBAG GIFT BOXES,2.55,United Kingdom,1
SET/10 IVORY POLKADOT PARTY CANDLES,1.25,United Kingdom,1
SET/10 BLUE POLKADOT PARTY CANDLES,1.25,United Kingdom,1
SET/10 PINK POLKADOT PARTY CANDLES,1.25,United Kingdom,1
SET OF 3 HEART COOKIE CUTTERS,1.25,United Kingdom,1
JUMBO STORAGE BAG SKULLS,1.95,United Kingdom,1
GARDEN PATH JOURNAL,2.55,United Kingdom,1
SET OF 72 GREEN PAPER DOILIES,1.45,United Kingdom,1
RETROSPOT RED WASHING UP GLOVES,2.1,United Kingdom,1
SMALL LICORICE DES PINK BOWL,1.25,United Kingdom,1
"SWISS ROLL TOWEL, CHOCOLATE  SPOTS",2.95,United Kingdom,1
PICNIC BASKET WICKER LARGE,9.95,United Kingdom,1
CREAM SWEETHEART EGG HOLDER,4.95,United Kingdom,1
PINK 3 PIECE POLKADOT CUTLERY SET,3.75,United Kingdom,1
PINK PARTY BAGS,2.1,United Kingdom,1
BLUE PARTY BAGS ,2.1,United Kingdom,1
FELTCRAFT PRINCESS CHARLOTTE DOLL,3.75,United Kingdom,1
PINK CREAM FELT CRAFT TRINKET BOX ,1.25,United Kingdom,1
FELTCRAFT CUSHION BUTTERFLY,3.75,United Kingdom,1
RED RETROSPOT OVEN GLOVE DOUBLE,2.95,United Kingdom,1
BOX OF 6 ASSORTED COLOUR TEASPOONS,4.25,United Kingdom,1
PACK OF 20 NAPKINS PANTRY DESIGN,0.85,United Kingdom,1
HAND WARMER SCOTTY DOG DESIGN,2.1,United Kingdom,1
SWEETHEART CAKESTAND 3 TIER,9.95,United Kingdom,1
SILK PURSE BABUSHKA PINK,3.35,United Kingdom,1
MULTICOLOUR  CONFETTI IN TUBE,1.65,United Kingdom,1
ORANGE SCENTED SET/9 T-LIGHTS,0.85,United Kingdom,1
SET/10 RED POLKADOT PARTY CANDLES,1.25,United Kingdom,1
CHOCOLATE 3 WICK MORRIS BOX CANDLE,4.25,United Kingdom,1
SET OF 16 VINTAGE PISTACHIO CUTLERY,12.75,United Kingdom,1
CINAMMON SET OF 9 T-LIGHTS,0.85,United Kingdom,1
CHRISTMAS LIGHTS 10 REINDEER,8.5,United Kingdom,1
PLACE SETTING WHITE HEART,0.42,United Kingdom,1
ZINC METAL HEART DECORATION,1.25,United Kingdom,1
SET/5 RED RETROSPOT LID GLASS BOWLS,2.95,United Kingdom,1
PINK HEARTS PAPER GARLAND,1.65,United Kingdom,1
BLUE 3 PIECE POLKADOT CUTLERY SET,3.75,United Kingdom,1
CHRISTMAS HANGING STAR WITH BELL,1.25,United Kingdom,1
BLACK/BLUE POLKADOT UMBRELLA,5.95,United Kingdom,1
PINK & WHITE BREAKFAST TRAY,5.95,United Kingdom,1
ENGLISH ROSE SPIRIT LEVEL ,1.95,United Kingdom,1
SET/10 RED POLKADOT PARTY CANDLES,1.25,United Kingdom,1
SET/10 PINK POLKADOT PARTY CANDLES,1.25,United Kingdom,1
LARGE ROUND WICKER PLATTER ,5.95,United Kingdom,1
FELTCRAFT HAIRBAND PINK AND PURPLE,0.85,United Kingdom,1
RIDGED GLASS STORAGE JAR CREAM LID,3.75,United Kingdom,1
HAND WARMER RED RETROSPOT,2.1,United Kingdom,1
SET/10 PINK POLKADOT PARTY CANDLES,1.25,United Kingdom,1
JUMBO BAG RED RETROSPOT,1.95,United Kingdom,1
JUMBO STORAGE BAG SUKI,1.95,United Kingdom,1
VINTAGE HEADS AND TAILS CARD GAME ,1.25,United Kingdom,1
HEADS AND TAILS SPORTING FUN,1.25,United Kingdom,1
FELTCRAFT 6 FLOWER FRIENDS,2.1,United Kingdom,1
ENAMEL MEASURING JUG CREAM,4.25,United Kingdom,1
ENAMEL FIRE BUCKET CREAM,6.95,United Kingdom,1
BLUE PAPER PARASOL ,2.95,United Kingdom,1
POSTAGE,18,Germany,1
HAND WARMER OWL DESIGN,2.1,United Kingdom,1
COSY HOUR GIANT TUBE MATCHES,2.55,United Kingdom,1
SET OF 72 GREEN PAPER DOILIES,1.45,United Kingdom,1
IVORY ENCHANTED FOREST PLACEMAT,1.65,United Kingdom,1
3 TIER CAKE TIN GREEN AND CREAM,14.95,United Kingdom,1
JUMBO SHOPPER VINTAGE RED PAISLEY,1.95,United Kingdom,1
PACK OF 12 LONDON TISSUES ,0.29,United Kingdom,1
MEASURING TAPE BABUSHKA RED,2.95,United Kingdom,1
HAND WARMER OWL DESIGN,2.1,United Kingdom,1
